WikiData QID	parent	ML_ID	label	description	wiktionary
		ML_CUSTOM_INDICATIVE-MOOD	indicative mood	The [mood](#mood) of a [verb](#verb) used in ordinary factual or objective statements.	https://en.wiktionary.org/wiki/indicative_mood
		ML_CUSTOM_INFIX	infix	A [morpheme](https://en.wiktionary.org/wiki/morpheme) or [affix](https://en.wiktionary.org/wiki/affix) inserted inside a word.	https://en.wiktionary.org/wiki/infix
		ML_CUSTOM_INFLECTION	inflection	The change in form of a word to represent various grammatical categories, such as [tense](#tense) (e.g. past tense, present tense, future tense) or [number](#number) (e.g. singular, plural). For example, the verb [_run_](https://en.wiktionary.org/wiki/run#English) may be inflected to produce [_runs_](https://en.wiktionary.org/wiki/runs#English), [_ran_](https://en.wiktionary.org/wiki/ran#English), and [_running_](https://en.wiktionary.org/wiki/running#English). In highly inflected languages, such as Latin, there will be many more forms. Two major types of inflection are [conjugation](#conjugation) (inflection of [verbs](#verb)) and [declension](#declension) (inflection of [nouns](#noun), [adjectives](#adjective), and [pronouns](#pronoun)).	https://en.wiktionary.org/wiki/inflection
		ML_CUSTOM_INFORMAL	informal	Denotes spoken or written words that are used primarily in a [familiar](#familiar) or casual context. Do not confuse with [_slang_](#slang) or [_nonstandard_](#nonstandard). See also [_colloquial_](#colloquial).	https://en.wiktionary.org/wiki/informal
		ML_CUSTOM_INHERITED	inherited	Denotes words which etymologically are not [borrowings](#loanword) but derive through regular or sporadic [sound change](#sound_change), without additional affixation, from a corresponding term in the language that is its direct historical ancestor. For example, English [_one_](https://en.wiktionary.org/wiki/one#English) is _inherited_ from Proto-Germanic [_*ainaz_](https://en.wiktionary.org/wiki/Reconstruction:Proto-Germanic/ainaz).	https://en.wiktionary.org/wiki/inherit
		ML_CUSTOM_INITIALISM	initialism	An [abbreviation](#abbreviation) that is formed from the initial letters of a sequence of words. Initialisms that are pronounced as words, such as [_UNICEF_](https://en.wiktionary.org/wiki/UNICEF#English), are usually called [_acronyms_](#acronym), so the term _initialism_ is generally only used for those that are pronounced letter by letter, such as [_U.S._](https://en.wiktionary.org/wiki/U.S.#English)	https://en.wiktionary.org/wiki/initialism
		ML_PHONOLOGY_INITIAL-VOWEL	initial vowel	_See [_augment_](#augment)._	
		ML_CUSTOM_INLINE-REFERENCE	inline reference	A reference whose point of application is indicated in the text.	
		ML_MORPH-VALUE_INSTRUMENTAL-CASE	instrumental case	A [case](#case) used to express means or agency—and is generally indicated in English by "by" or "with" with the objective.	https://en.wiktionary.org/wiki/instrumental_case
		ML_CUSTOM_INTENSIFIER	intensifier	A [word](#word) or [particle](#particle) that heightens the intensity of meaning of a term.	https://en.wiktionary.org/wiki/intensifier
		ML_CUSTOM_INTENSIVE	intensive	A word form expressing great size, power or emotion. Opposite of [diminutive](#diminutive).	https://en.wiktionary.org/wiki/intensive
		ML_CUSTOM_INTERFIX	interfix	An [empty morph](https://en.wiktionary.org/wiki/empty_morph) (or meaningless morph) inserted between two [morphemes](https://en.wiktionary.org/wiki/morpheme) in the process of word formation, such as [_-i-_](https://en.wiktionary.org/wiki/-i-#English) and [_-o-_](https://en.wiktionary.org/wiki/-o-#English) in English.	https://en.wiktionary.org/wiki/interfix
		ML_CUSTOM_INTERNATIONALISM	internationalism	A loanword that occurs in several languages with the same or similar meaning and etymology, often due to the occurrence of several simultaneous borrowings and/or a chain of successive borrowings happening in quick succession. This commonly results in the exact etymological lineage of a term being difficult or impossible to trace for a given language. For example _bus, doctor, hotel, internet, taxi,_ or _television._ [International scientific vocabulary](https://en.wikipedia.org/wiki/International_scientific_vocabulary) is a large subclass of internationalisms.	https://en.wiktionary.org/wiki/internationalism
		ML_CUSTOM_INTERROGATIVE	interrogative	A word used to ask questions.	https://en.wiktionary.org/wiki/interrogative
		ML_CUSTOM_INTRANSITIVE	intransitive	Of a [verb](#verb): not taking a [direct object](#direct_object); not [transitive](#transitive). For example, the verb [_listen_](https://en.wiktionary.org/wiki/listen#English) does not usually take a direct object; it is grammatically incorrect to say "I listened the concert" (instead of the correct "I listened to the concert" with the [indirect object](#indirect_object) "to the concert"). / Of an adposition (such as a [preposition](#preposition)), or of an [adverb](#adverb): not having a [nominal](#nominal) complement. For example, using the following prepositions or adverbs without a complement (here in parentheses): [_down_](https://en.wiktionary.org/wiki/down#English) (the stairs), [_under_](https://en.wiktionary.org/wiki/under#English) (the bridge), [_inside_](https://en.wiktionary.org/wiki/inside#English) (the building), [_aboard_](https://en.wiktionary.org/wiki/aboard#English) (the ship), [_underneath_](https://en.wiktionary.org/wiki/underneath#English) (the table), [_here_](https://en.wiktionary.org/wiki/here#English), [_there_](https://en.wiktionary.org/wiki/there#English), [_abroad_](https://en.wiktionary.org/wiki/abroad#English), [_downtown_](https://en.wiktionary.org/wiki/downtown#English), [_afterwards_](https://en.wiktionary.org/wiki/afterwards#English), …	https://en.wiktionary.org/wiki/intransitive
		ML_CUSTOM_INVARIABLE	invariable	_See [_indeclinable_](#indeclinable)._	https://en.wiktionary.org/wiki/invariable
		ML_CUSTOM_INVARIANT	invariant	_See [_indeclinable_](#indeclinable)._	https://en.wiktionary.org/wiki/invariant
		ML_CUSTOM_INVERSION	inversion	A grammatical construction where the normal word order is reversed. An example in English is: "Will Fred stay?"	https://en.wiktionary.org/wiki/inversion
		ML_CUSTOM_IOTATION	iotation	A specific occurrence of [palatalization](#palatalization) that occurred in the [Proto-Slavic language](https://en.wikipedia.org/wiki/Proto-Slavic_language), in which a [consonant](#consonant) combined with the palatal approximant /j/ to form a palatalized [consonant](#consonant). Also, any similar process occurring in a later [Slavic language](https://en.wikipedia.org/wiki/Slavic_languages) or elsewhere. For example, under certain circumstances in [Russian](https://en.wikipedia.org/wiki/Russian_language), underlying _s; z; t; d; k; g_ are iotated to _š; ž; č or šč; ž; č; ž_ respectively (pronounced /ʂ/; /ʐ/; /t͡ɕ/ or /ɕː/; /ʐ/; /t͡ɕ/; /ʐ/ respectively). (See [_Appendix:Russian verbs § Slavic iotation_](https://en.wiktionary.org/wiki/Appendix:Russian_verbs#Slavic_iotation) for the full iotation rules in [Russian](https://en.wikipedia.org/wiki/Russian_language); other [Slavic languages](https://en.wikipedia.org/wiki/Slavic_languages) behave similarly.)	https://en.wiktionary.org/wiki/iotation
		ML_CUSTOM_IPA	IPA	The [International Phonetic Alphabet](https://en.wikipedia.org/wiki/International_Phonetic_Alphabet); a standardized system for transcribing the sounds in any spoken language.	https://en.wiktionary.org/wiki/IPA
		ML_CUSTOM_IRB	ʾiʿrāb	Also called [desinential inflection](https://en.wiktionary.org/wiki/desinential_inflection); in Arabic: [_إِعْرَاب_](https://en.wiktionary.org/wiki/%D8%A5%D8%B9%D8%B1%D8%A7%D8%A8#Arabic) (ʔiʕrāb). A number of [inflectional](#inflection) endings, applied to Arabic nouns, adjectives, and verbs, which—with minor exceptions—do not appear in writing, and moreover are not pronounced in [pausa](https://en.wiktionary.org/wiki/pausa), i.e. at the end of a sentence or before a pause. Nevertheless, these endings are a regular and required element of Qur'ānic and Classical Arabic. In Modern Standard Arabic, however, they are rather often avoided due to dialectal influence. In nouns and adjectives, the ʾiʿrāb primarily has the function of marking the cases ([nominative](#nominative), [genitive](#genitive), [accusative](#accusative)), while in verbs it marks the moods ([indicative](#indicative), [subjunctive](#subjunctive), [jussive](#jussive)). All of these are only occasionally distinguishable without application of the ʾiʿrāb.	https://en.wiktionary.org/wiki/%CA%BEi%CA%BFr%C4%81b
		ML_CUSTOM_IRREGULAR	irregular	Not following the usual rules of [inflection](#inflection); for example, the plural of English [_man_](https://en.wiktionary.org/wiki/man#English) is [_men_](https://en.wiktionary.org/wiki/men#English), which is irregular; the regularly formed plural would have been *_mans_.	https://en.wiktionary.org/wiki/irregular
		ML_CUSTOM_ITERATIVE	iterative	Expressive of an action that is repeated with frequency.	https://en.wiktionary.org/wiki/iterative
		ML_CUSTOM_IZAFET	izafet	The [possessive](https://en.wiktionary.org/wiki/possessive) or [genitive](https://en.wiktionary.org/wiki/genitive) construction in [Turkic languages](https://en.wikipedia.org/wiki/Turkic_languages) such as [Azerbaijani](https://en.wikipedia.org/wiki/Azerbaijani). The term, and sometimes the grammatical structure, is borrowed from Persian [_اِضافِه_](https://en.wiktionary.org/wiki/%D8%A7%D8%B6%D8%A7%D9%81%D9%87#Persian) (ezâfe) (see [ezafe](#ezafe)), which comes in turn from Arabic [_إِضَافَة_](https://en.wiktionary.org/wiki/%D8%A5%D8%B6%D8%A7%D9%81%D8%A9#Arabic) (ʔiḍāfa) (see [ʾiḍāfa](#ʾiḍāfa)). Native _izafet_ constructions in Turkic languages are right-headed (the first term modifies the second), but some constructions (especially in elevated or older style, such as [Classical Azerbaijani](https://en.wikipedia.org/wiki/Classical_Azerbaijani) and [Ottoman Turkish](https://en.wikipedia.org/wiki/Ottoman_Turkish)) are left-headed in imitation of Persian grammar. There are three native _izafet_ constructions: (a) type I, where both nouns are zero-marked; (b) type II, where the first noun is zero-marked and the second receives a possessive suffix; and (c) type III, where the first noun is in the genitive case and the second receives a possessive suffix.	https://en.wiktionary.org/wiki/izafet
		ML_CUSTOM_JUSSIVE-MOOD	jussive mood	In certain languages (e.g. Hebrew, Arabic and Esperanto), a [mood](#mood) of a [verb](#verb) used to indicate a command, permission or agreement with a request (distinct from the [imperative](#imperative_mood)).	https://en.wiktionary.org/wiki/jussive
		ML_CUSTOM_KARMADHARAYA	karmadharaya	Another term for a [_descriptive compound_](#descriptive_compound). / Contrast [bahuvrihi](#bahuvrihi), [tatpurusa](#tatpurusa) and [dvandva](#dvandva).	https://en.wiktionary.org/wiki/karmadharaya
		ML_CUSTOM_KATHAREVOUSA	Katharevousa	The [classically](https://en.wiktionary.org/wiki/classical_language) based artificial ([standardized](https://en.wikipedia.org/wiki/standard_language)) Greek language created at the start of Greece's independence from the [Ottoman Empire](https://en.wikipedia.org/wiki/Ottoman_Empire). It was used for all formal and official purposes until 1976.(Note: In Wiktionary, Katharevousa terms are entered under (modern) [Greek](https://en.wiktionary.org/wiki/Category:Greek_language).)	https://en.wiktionary.org/wiki/Katharevousa
		ML_CUSTOM_KENNING	kenning	A [metaphorical](https://en.wiktionary.org/wiki/metaphorical) compound or phrase describing basic objects in an [allusive](https://en.wiktionary.org/wiki/allusive) fashion, especially in Germanic poetry.	https://en.wiktionary.org/wiki/kenning#English:_poetry
		ML_CUSTOM_KULTURWORT	Kulturwort	A type of [Wanderwort](#wanderwort) which is specific to a particular culture or which is spread by an influential cross-cultural phenomenon. Kulturworts (or _Kulturwörter_) are often names of products distributed by trade and religious or ideological terms.	https://en.wiktionary.org/wiki/Kulturwort
		ML_CUSTOM_LEARNED-BORROWING	learned borrowing	A [loanword](#loanword) that was borrowed directly on purpose, instead of through normal [language contact](https://en.wiktionary.org/wiki/language_contact), from another language, especially [classical languages](https://en.wiktionary.org/wiki/classical_language) such as Latin, Ancient Greek or Sanskrit, and which has not undergone significant reshaping due to [sound change](#sound_change) or analogy with inherited terms. Such borrowings are thus often [unadapted](#unadapted_borrowing). Compare with [semi-learned borrowings](#semi-learned_borrowing), which have been significantly reshaped ([adapted](#adapted_borrowing)), and [inherited](#inherited) terms, which have undergone all the normal sound changes of a language. A theme of Latin's influence on modern European languages is that in many cases the same Latin word has been borrowed into any given modern language multiple times in different eras, and the morphologic and semantic facts about each descendant word differ in predictable ways (by eras); a concise summary for the case of English (for example) is offered in some introductory textbooks, such as Burriss and Casson. A typical example of this process is that the Portuguese term [_artículo_](https://en.wiktionary.org/wiki/art%C3%ADculo#Portuguese) (“[articulus](https://en.wiktionary.org/wiki/articulus)”) is a learned borrowing from Latin [_articulus_](https://en.wiktionary.org/wiki/articulus#Latin) (“joint, limb, division”); the term [_artigo_](https://en.wiktionary.org/wiki/artigo#Portuguese) (“article”) is a semi-learned borrowing from the same term, which was borrowed early enough to undergo later sound changes that [lenited](https://en.wiktionary.org/wiki/lenite) _c_ into _g_ and deleted _l_ between vowels; and the term [_artelho_](https://en.wiktionary.org/wiki/artelho#Portuguese) (“toe”) is inherited from the same Latin term.	https://en.wiktionary.org/wiki/learned_borrowing
		ML_CUSTOM_LEMMA	lemma	The headword or citation form of an [inflected](#inflection) word, i.e. the form under which a word is found in a dictionary. For example, in English, nouns are usually listed under their singular form (_apple_, rather than _apples_), and verbs under their infinitive form (_open_, rather than _opens_, _opened_ or _opening_). Which form is used as the lemma varies from language to language. For verbs, for example, French, German, Spanish and many other European languages use the [infinitive](https://en.wiktionary.org/wiki/infinitive), but Latin, Greek and Bulgarian use the [first-person](https://en.wiktionary.org/wiki/first-person) [singular](https://en.wiktionary.org/wiki/singular) [present](https://en.wiktionary.org/wiki/present) [indicative](https://en.wiktionary.org/wiki/indicative), while Macedonian uses the [third-person](https://en.wiktionary.org/wiki/third-person) [singular](https://en.wiktionary.org/wiki/singular) [present](https://en.wiktionary.org/wiki/present) [indicative](https://en.wiktionary.org/wiki/indicative), and Arabic and Hebrew use the [masculine](https://en.wiktionary.org/wiki/masculine) [third-person](https://en.wiktionary.org/wiki/third-person) [singular](https://en.wiktionary.org/wiki/singular) [past](https://en.wiktionary.org/wiki/past) [indicative](https://en.wiktionary.org/wiki/indicative). See also [Wiktionary:Lemmas](https://en.wiktionary.org/wiki/Wiktionary:Lemmas).	https://en.wiktionary.org/wiki/lemma
		ML_MORPH-VALUE_LETTER-CASE	letter case	The distinction between [majuscule](https://en.wiktionary.org/wiki/majuscule) ([uppercase](https://en.wiktionary.org/wiki/uppercase)) and [minuscule](https://en.wiktionary.org/wiki/minuscule) ([lowercase](https://en.wiktionary.org/wiki/lowercase)) letters.	https://en.wiktionary.org/wiki/letter_case
		ML_CUSTOM_LEXEME	lexeme	The abstract "word" underlying a set of inflections; for example, _gives_ and _given_ belong to the same lexeme, which is usually identified by its lemma form [_give_](https://en.wiktionary.org/wiki/give#English). See also: (1) [Wikipedia's article on lexemes](https://en.wikipedia.org/wiki/lexeme), (2) [Wiktionary:Languages with more than one grammatical gender](https://en.wiktionary.org/wiki/Wiktionary:Languages_with_more_than_one_grammatical_gender), (3) [conjugation](#C) and (4) [declension](#D).	https://en.wiktionary.org/wiki/lexeme
		ML_CUSTOM_LIAISON	liaison	The phonological fusion of two consecutive words and the manner in which this occurs, for example intrusion, consonant–vowel linking, etc.	https://en.wiktionary.org/wiki/liaison
		ML_CUSTOM_LIGATURE	ligature	A character that visually combines multiple letters, such as [_æ_](https://en.wiktionary.org/wiki/%C3%A6#Translingual), [_œ_](https://en.wiktionary.org/wiki/%C5%93#Translingual), [_ß_](https://en.wiktionary.org/wiki/%C3%9F#Translingual) or [_ĳ_](https://en.wiktionary.org/wiki/%C4%B3#Translingual).	https://en.wiktionary.org/wiki/ligature
		ML_POS_LINKING-VERB	linking verb	Another term for [copula](#copula).	https://en.wiktionary.org/wiki/linking_verb
		ML_CUSTOM_LITERAL	literal	Exactly as stated; read or understood without additional interpretation; not [figurative](#figurative) or [metaphorical](#metaphorical).	https://en.wiktionary.org/wiki/literal
		ML_CUSTOM_LITERARY	literary	A [higher](#higher_register) [register](#register) found mainly in literature.	https://en.wiktionary.org/wiki/literary
		ML_CUSTOM_LITOTES	litotes	Stating a positive by negating the negative — a form of understatement. ("I am not unaware of your difficulties.")	https://en.wiktionary.org/wiki/litotes
		ML_CUSTOM_LOANBLEND	loanblend	A [partial calque](#partial_calque).	https://en.wiktionary.org/wiki/loanblend
		ML_MORPH-VALUE_LOCATIVE-CASE	locative case	[Locative](https://en.wiktionary.org/wiki/locative). A [case](#case) used to indicate place, or the place where, or wherein. It corresponds roughly to the English prepositions "in", "on", "at", and "by". Some languages use the same locative case construct to indicate when, so the English phrase "in summer" would use the locative case construct.	https://en.wiktionary.org/wiki/locative_case
		ML_MORPH-VALUE_LOCATIVE-QUALITATIVE-CASE	locative-qualitative case	Nouns in the form of the locative-qualitative case are qualifiers in the sentence and signify the locational or temporal mark of the qualified word. The qualifier is not specific but general or universalized. / See also [_Appendix:Uyghur nouns_](https://en.wiktionary.org/wiki/Appendix:Uyghur_nouns).	https://en.wiktionary.org/wiki/locative-qualitative_case
		ML_CUSTOM_LOGOPHORICITY	logophoricity	Logophorical pronouns (logophors) are personal pronouns in some languages (such as Ainu, Ewe and Japanese) that marks the speaker when being quoted (or the entity whose thoughts or feelings are being reported). See also: [Wikipedia's article on logophoricity](https://en.wikipedia.org/wiki/logophoricity).	https://en.wiktionary.org/wiki/logophoricity
		ML_CUSTOM_LOOSELY	loosely	Indicates an imprecise use of words; short for _loosely speaking_. For most practical purposes, synonymous with [broadly](#broad). / Contrast _strict_ or _narrow_ sense; [_strictly_](#strictly).	https://en.wiktionary.org/wiki/loosely
		ML_CUSTOM_M	m	_See [_masculine_](#masculine)._	
		ML_CUSTOM_MPL	mpl	[Masculine](#masculine) [plural](#plural).	
		ML_CUSTOM_MACRON	macron	A short, straight, horizontal [diacritical](#diacritic) mark ( ¯ ) placed over any of various letters, usually to indicate that the pronunciation of a [vowel](#vowel) is long.	https://en.wiktionary.org/wiki/macron
		ML_CUSTOM_MARKED	marked	The quality of a sound (etc.) to [stand out](https://en.wiktionary.org/wiki/stand_out) in some way compared to a more [trivial](https://en.wiktionary.org/wiki/trivial) or [default](https://en.wiktionary.org/wiki/default) counterpart (which is **unmarked**), such as by requiring an extra [feature](https://en.wiktionary.org/wiki/feature) to [articulate](https://en.wiktionary.org/wiki/articulate) or by carrying a [morphological](https://en.wiktionary.org/wiki/morphological) power absent from the unmarked form.	https://en.wiktionary.org/wiki/marked
		ML_POS_MASS-NOUN	mass noun	_See [_uncountable_](#uncountable)._	https://en.wiktionary.org/wiki/mass_noun
		ML_CUSTOM_MEASURE-WORD	measure word	_See [_counter_](#counter)._	https://en.wiktionary.org/wiki/measure_word
		ML_CUSTOM_MEDIOPASSIVE	mediopassive	The grammatical [voice](#voice) that subsumes the meanings of both the [middle voice](#middle_voice) and [passive voice](#passive_voice). Several languages (e.g. [Sanskrit](https://en.wiktionary.org/wiki/Sanskrit), [Greek](https://en.wiktionary.org/wiki/Greek), [Icelandic](https://en.wiktionary.org/wiki/Icelandic) and [Albanian](https://en.wiktionary.org/wiki/Albanian)) make a [morphological](#morphology) distinction between active and mediopassive voices, and in such languages, the mediopassive can have either middle, passive or (often) [reflexive](#reflexive) semantics. Often used interchangeably with the [middle voice](#middle_voice).	https://en.wiktionary.org/wiki/mediopassive
		ML_CUSTOM_MEN-S-SPEECH	men 's speech	In certain languages (for example, [Karajá language](https://en.wikipedia.org/wiki/Karaj%C3%A1_language)), men and women use or historically used distinct words and inflected forms. / Compare [women's speech](#women's_speech).	https://en.wiktionary.org/wiki/men, https://en.wiktionary.org/wiki/speech
		ML_CUSTOM_MERGER	merger	In etymology, a [confluence](https://en.wiktionary.org/wiki/confluence) of two etymologically separate sources into eventually one and the same term, motivated by a coincidental [phono-semantic](https://en.wiktionary.org/wiki/phono-semantic) similarity between them. For example, Old English [_nǣmel_](https://en.wiktionary.org/wiki/n%C3%A6mel#Old_English) (“receptive, quick to grasp”) and [_numol_](https://en.wiktionary.org/wiki/numol#Old_English) (“able to take, capable of holding”) apparently merged into English [_nimble_](https://en.wiktionary.org/wiki/nimble#English), which absorbed the [semantics](https://en.wiktionary.org/wiki/semantics) of both words. An extreme type of [conflation](#conflation). Contrast [_blend_](#blend). In phonology, a [sound change](https://en.wiktionary.org/wiki/sound_change) that results in two [phonemes](#phoneme) (typically referring to [vowels](#vowel)) becoming one phoneme as a result of increasingly similar pronunciation over time. This need not affect an entire language, but will (at least initially) apply to a particular [variety](#variety) of the language, such as one regional “[accent](https://en.wiktionary.org/wiki/accent)” or [dialect](https://en.wiktionary.org/wiki/dialect). Example: the recent [cot-caught merger](https://en.wiktionary.org/wiki/cot-caught_merger) affecting some English speakers.	https://en.wiktionary.org/wiki/merger
		ML_CUSTOM_MERONYM	meronym	A term that denotes a part of the whole that is denoted by another term. For example, the word "arm" is a **meronym** of the word "body". The term which describes the _whole_, as being an opposite of meronym, is [_holonym_](#holonym).	https://en.wiktionary.org/wiki/meronym
		ML_CUSTOM_METAPHORICAL	metaphorical	The use of a word or phrase as a [metaphor](https://en.wiktionary.org/wiki/metaphor) to refer to something that it is not, invoking a direct similarity between the word or phrase used and the thing described. See also [simile](#simile) and [figurative](#figurative).	https://en.wiktionary.org/wiki/metaphorical
		ML_CUSTOM_METANALYSIS	metanalysis	_See [_rebracketing_](#rebracketing)._	https://en.wiktionary.org/wiki/metanalysis
		ML_CUSTOM_METATHESIS	metathesis	A [sound change](#sound_change) in which two sounds or groups of sounds exchange position in a word. A form showing metathesis is described as [_metathetic_](https://en.wiktionary.org/wiki/metathetic#English). The sounds may be adjacent, as in [_ax_](https://en.wiktionary.org/wiki/ax#English), the metathetic form of the verb [_ask_](https://en.wiktionary.org/wiki/ask#English), or farther apart, as in Spanish [_palabra_](https://en.wiktionary.org/wiki/palabra#Spanish) from Latin [_parabola_](https://en.wiktionary.org/wiki/parabola#Latin); there, the sound change is [hyperthesis](#hyperthesis).	https://en.wiktionary.org/wiki/metathesis
		ML_CUSTOM_METONYM	metonym	A figure of speech which substitutes one part for the whole. For example, to count how many cattle in a herd, one counts the heads. To describe the herd, one would say, "There are fifty head of cattle." This does not mean there are only heads, but the head is substituting for the whole animal.	https://en.wiktionary.org/wiki/metonym
		ML_CUSTOM_MIDDLE-VOICE	middle voice	The [voice](#voice) verb form in which the [subject](#subject) of a verb performs some action upon itself, as in the English sentence _The plane landed_ (contrast [active voice](#active_voice) _The pilot landed the plane_ and [passive voice](#passive_voice) _The plane was landed (by the pilot)_). Often used interchangeably with the [mediopassive voice](#mediopassive_voice). In some languages, such as [Sanskrit](https://en.wiktionary.org/wiki/Sanskrit), [Ancient Greek](https://en.wiktionary.org/wiki/Ancient_Greek), [Icelandic](https://en.wiktionary.org/wiki/Icelandic) and [Albanian](https://en.wiktionary.org/wiki/Albanian), the middle voice is distinguished [morphologically](#morphology) from the active voice. [Ancient Greek](https://en.wiktionary.org/wiki/Ancient_Greek), in particular, has a three-way morphological distinction between active, middle and passive voices in the [aorist](#aorist) and [future](#future) tenses.	https://en.wiktionary.org/wiki/middle_voice
