WikiData QID	parent	ML_ID	label	description	wiktionary
		ML_CUSTOM_PSEUDO-LOAN	pseudo-loan	A word in one language that appears to be a direct borrowing from another language, but does not exist in that language or has an unrelated meaning. Examples from English include French [_footing_](https://en.wiktionary.org/wiki/footing#French) (“jogging”), German [_Bodybag_](https://en.wiktionary.org/wiki/Bodybag#German) (“messenger bag, courier bag”), Japanese [_サラリーマン_](https://en.wiktionary.org/wiki/%E3%82%B5%E3%83%A9%E3%83%AA%E3%83%BC%E3%83%9E%E3%83%B3#Japanese) (sararīman, “white-collar worker, '[salaryman](https://en.wiktionary.org/wiki/salaryman)'”) and Swedish [_afterwork_](https://en.wiktionary.org/wiki/afterwork#Swedish) (“informal gathering after work”). Depending on the source language, more specific terms may be in use, e.g. [_pseudo-anglicism_](https://en.wiktionary.org/wiki/pseudo-anglicism) for pseudo-loans from English; [_wasei-eigo_](https://en.wikipedia.org/wiki/wasei-eigo) specifically for Japanese-language pseudo-loans from English; [_wasei-kango_](https://en.wikipedia.org/wiki/wasei-kango) for Japanese-language pseudo-loans from Chinese; [_pseudo-Latinism_](https://en.wiktionary.org/wiki/Category:Pseudo-loans_from_Latin_by_language) for pseudo-loans from Latin (cf. [hocus-pocus](https://en.wiktionary.org/wiki/hocus-pocus), [noli illegitimi carborundum](https://en.wiktionary.org/wiki/noli_illegitimi_carborundum)); [_pseudo-Hispanism_](https://en.wiktionary.org/wiki/Category:Pseudo-loans_from_Spanish_by_language) for pseudo-loans from Spanish (cf. [no problemo](https://en.wiktionary.org/wiki/no_problemo), [que sera sera](https://en.wiktionary.org/wiki/que_sera_sera)); [_pseudo-Gallicism_](https://en.wiktionary.org/wiki/Category:Pseudo-loans_from_French_by_language) for pseudo-loans from French (cf. [vive la différence](https://en.wiktionary.org/wiki/vive_la_diff%C3%A9rence), [nom de plume](https://en.wiktionary.org/wiki/nom_de_plume), [triple entendre](https://en.wiktionary.org/wiki/triple_entendre)); [_pseudo-Germanism_](https://en.wiktionary.org/wiki/Category:Pseudo-loans_from_German_by_language) (from German), [_pseudo-Japonism_](https://en.wiktionary.org/wiki/Category:Pseudo-loans_from_Japanese_by_language) (from Japanese), [_pseudo-Arabism_](https://en.wiktionary.org/wiki/Category:Pseudo-loans_from_Arabic_by_language) (from Arabic), [_pseudo-Italianism_](https://en.wiktionary.org/wiki/Category:Pseudo-loans_from_Italian_by_language) (from Italian), etc.	https://en.wiktionary.org/wiki/pseudo-loan
		ML_CUSTOM_QUANTIFIER	quantifier	A word that specifies the amount of its related noun, such as [all](https://en.wiktionary.org/wiki/all), [no](https://en.wiktionary.org/wiki/no), [many](https://en.wiktionary.org/wiki/many), [several](https://en.wiktionary.org/wiki/several), [eight](https://en.wiktionary.org/wiki/eight), [half](https://en.wiktionary.org/wiki/half), etc.	https://en.wiktionary.org/wiki/quantifier
		ML_CUSTOM_RARE	rare	A term or sense that is attested but not used commonly either in spoken or written language, even less so than [uncommon](#uncommon) terms. A rare term or sense is typically difficult to find even when deliberately searching for it, and may be attested only a handful of times in accessible [corpora](#corpus).	https://en.wiktionary.org/wiki/rare
		ML_CUSTOM_REANALYSIS	reanalysis	Analysis of a [lexeme](#lexeme) with a different structure from its original, often by misunderstanding. For example, [_hamburger_](https://en.wiktionary.org/wiki/hamburger#English), which is originally [_Hamburg_](https://en.wiktionary.org/wiki/Hamburg#English) + [_-er_](https://en.wiktionary.org/wiki/-er#English), was reanalyzed as [_ham_](https://en.wiktionary.org/wiki/ham#English) + [_burger_](https://en.wiktionary.org/wiki/burger#English), which produced words like [_cheeseburger_](https://en.wiktionary.org/wiki/cheeseburger#English).	https://en.wiktionary.org/wiki/reanalysis
		ML_CUSTOM_REBRACKETING	rebracketing	The process by which a word originally derived from one source is broken down or bracketed into a different set of factors. The understanding of [_hamburger_](https://en.wiktionary.org/wiki/hamburger#English) as [_ham_](https://en.wiktionary.org/wiki/ham#English) + [_burger_](https://en.wiktionary.org/wiki/burger#English) (rather than [_Hamburg_](https://en.wiktionary.org/wiki/Hamburg#English) + [_-er_](https://en.wiktionary.org/wiki/-er#English)) is an example of rebracketing. Also called [**metanalysis**](https://en.wiktionary.org/wiki/metanalysis).	https://en.wiktionary.org/wiki/rebracketing
		ML_CUSTOM_RECIPROCAL	reciprocal	Used to indicate that subjects have other subjects as object. Pronouns can be reciprocal (in English [_each other_](https://en.wiktionary.org/wiki/each_other#English)), as well as verbs [reciprocal](https://en.wiktionary.org/wiki/reciprocal) quality as [lexemes](#lexeme).	https://en.wiktionary.org/wiki/reciprocal
		ML_CUSTOM_RECONSTRUCTION	reconstruction	A word that is not recorded in actual texts or other media, but has been recreated from its descendant forms, using the [comparative method](https://en.wiktionary.org/wiki/comparative_method) of linguistics.	https://en.wiktionary.org/wiki/reconstruction
		ML_CUSTOM_REDUCIBLE	reducible	In the [Slavic languages](https://en.wikipedia.org/wiki/Slavic_languages), a word (especially a noun or adjective) with an alternation between a vowel and no vowel in different forms of the word, pursuant to [Havlík’s law](https://en.wikipedia.org/wiki/Havl%C3%ADk%27s_law). In Russian, for example, the reducible masculine noun [_вене́ц_](https://en.wiktionary.org/wiki/%D0%B2%D0%B5%D0%BD%D0%B5%D1%86#Russian) (venéc, “[crown](https://en.wiktionary.org/wiki/crown)”) appears unreduced (with /e/ in the final syllable) in the masculine singular, and reduced (with no /e/) in other forms, e.g. genitive singular [_венца́_](https://en.wiktionary.org/wiki/%D0%B2%D0%B5%D0%BD%D1%86%D0%B0#Russian) (vencá), nominative plural [_венцы́_](https://en.wiktionary.org/wiki/%D0%B2%D0%B5%D0%BD%D1%86%D1%8B#Russian) (vencý).	https://en.wiktionary.org/wiki/reducible
		ML_CUSTOM_REDUPLICATION	reduplication	The repetition of a word or a part of a word (as few as two [phonemes](#phoneme) in a word, or the whole sequence of phonemes in the word) with no or slight change. Compare [haplology](#haplology), the [elision](#elision) of a repeated part of a word.	https://en.wiktionary.org/wiki/reduplication
		ML_CUSTOM_REFLEX	reflex	The name given to a descendant word in a [daughter language](https://en.wiktionary.org/wiki/daughter_language), descended from an earlier language. For example, Modern English [_heat_](https://en.wiktionary.org/wiki/heat#English) is the reflex of the Old English [_hǣtu_](https://en.wiktionary.org/wiki/h%C3%A6tu#Old_English). / Rarely, this word is used in reverse, and the 'reflex' is actually the root word rather than the descendant word. However, this usage is usually filled by the term [_etymon_](https://en.wiktionary.org/wiki/etymon#English) instead.	https://en.wiktionary.org/wiki/reflex
		ML_CUSTOM_REFLEXIVE	reflexive	Referring back to the subject, or having an object equal to the subject. Pronouns can be reflexive (e.g. [_myself_](https://en.wiktionary.org/wiki/myself#English), [_oneself_](https://en.wiktionary.org/wiki/oneself#English)). [Romance](https://en.wiktionary.org/wiki/Romance_language) and Slavic languages make extensive use of reflexive verb forms (e.g. Italian [_lavarsi_](https://en.wiktionary.org/wiki/lavarsi#Italian), Spanish [_lavarse_](https://en.wiktionary.org/wiki/lavarse#Spanish) (“to wash oneself”)). These are part of a larger group of [pronominal verbs](#pronominal_verb).	https://en.wiktionary.org/wiki/reflexive
		ML_CUSTOM_REGISTER	register	A variety of a language used for a particular purpose or in a particular social setting. Encompasses variants such as [slang](#slang), [colloquial](#colloquial), [informal](#informal), [formal](#formal), etc.	https://en.wiktionary.org/wiki/register#English:_language_register
		ML_CUSTOM_RELATED-TERMS	related terms	Words in the same language that have strong etymological connections but are **not** derived terms.	https://en.wiktionary.org/wiki/Wiktionary:Entry_layout_explained#Related_terms
		ML_CUSTOM_RELATIONAL	relational	Refers to a type of adjective in some languages, e.g. Latin, Ancient Greek, and the [Slavic languages](https://en.wikipedia.org/wiki/Slavic_languages), that takes the place of a noun when it modifies another noun. Consider an English phrase such as _chicken soup_. In English, this phrase can be constructed by simply placing a noun such as _chicken_ in the position normally occupied by an adjective, i.e. directly before the noun. In languages such as Russian, however, this cannot be done, and instead the word [_ку́рица_](https://en.wiktionary.org/wiki/%D0%BA%D1%83%D1%80%D0%B8%D1%86%D0%B0#Russian) (kúrica, “chicken”) must be replaced by the relational adjective [_кури́ный_](https://en.wiktionary.org/wiki/%D0%BA%D1%83%D1%80%D0%B8%D0%BD%D1%8B%D0%B9#Russian) (kurínyj, “related to chickens”) when forming the Russian equivalent _[_кури́ный_](https://en.wiktionary.org/wiki/%D0%BA%D1%83%D1%80%D0%B8%D0%BD%D1%8B%D0%B9#Russian) [_суп_](https://en.wiktionary.org/wiki/%D1%81%D1%83%D0%BF#Russian)_ (kurínyj sup, “chicken soup”). Generally, adjectives of this sort cannot be qualified by _more_, _less_ or _very_. This concept relates to the concept of the [noun adjunct](https://en.wiktionary.org/wiki/noun_adjunct) or, in English [attributive noun](https://en.wiktionary.org/wiki/attributive_noun).	https://en.wiktionary.org/wiki/relational
		ML_CUSTOM_RELATIVE	relative	Marking a [relative clause](#relative_clause). Often used of pronouns, such as _the tree [_which_](https://en.wiktionary.org/wiki/which#English)..._. In the [Bantu languages](https://en.wikipedia.org/wiki/Bantu_languages), a [part of speech](#part_of_speech) that resembles an [adjective](#adjective) in function, but behaves morphologically and syntactically like a [relative clause](#relative_clause).	https://en.wiktionary.org/wiki/relative
		ML_CUSTOM_RELATIVE-CLAUSE	relative clause	A [subordinate clause](#subordinate_clause) that modifies a [noun](#noun). In _The man who I saw yesterday is leaving today_, the clause _who I saw yesterday_ is a relative clause. In English, relative clauses are often introduced by a [relative](#relative) [pronoun](#pronoun) such as _who_, _which_ or _that_, but other languages often have different strategies for marking relative clauses.	https://en.wiktionary.org/wiki/relative_clause
		ML_CUSTOM_RESPELLING	respelling	A different spelling of a word, especially to show its pronunciation.	https://en.wiktionary.org/wiki/respelling
		ML_CUSTOM_RETRONYM	retronym	A new word or phrase coined for an old object or concept whose original name has become used for something else or is no longer unique (such as acoustic guitar where guitar used to mean this but can now also refer to an electric guitar).	https://en.wiktionary.org/wiki/retronym
		ML_CUSTOM_RHETORIC	rhetoric	The study and practice of good effective expression. Also, a type of discourse focusing on goals of the speech or piece of writing that attempts to sway the mind of the audience.	https://en.wiktionary.org/wiki/rhetoric
		ML_CUSTOM_RHETORICAL-QUESTION	rhetorical question	A question to which the speaker does not expect an answer	https://en.wiktionary.org/wiki/rhetorical_question
		ML_CUSTOM_RHOTACISM	rhotacism	A [sound change](#sound_change) that converts one consonant (usually a voiced alveolar consonant /d/, /z/, /l/, /n/) to a [rhotic](https://en.wiktionary.org/wiki/rhotic) consonant in a certain environment, most commonly /z/ to /r/. The opposite process: changing /r/ to /z/, or to a different consonant, or [elision](#elision).	https://en.wiktionary.org/wiki/rhotacism, https://en.wiktionary.org/wiki/rhotacization
		ML_CUSTOM_ROMANIZATION	Romanization	[Transliteration](#transliteration) of a string in a non-Latin script into the Latin or Roman one: for instance, [_συγγνώμη_](https://en.wiktionary.org/wiki/%CF%83%CF%85%CE%B3%CE%B3%CE%BD%CF%8E%CE%BC%CE%B7#Greek) can be romanized as _singnómi_.	https://en.wiktionary.org/wiki/Romanization, https://en.wiktionary.org/wiki/Romanisation
		ML_CUSTOM_RUSTIC	rustic	Describes a word as part of 'rural' speech. Different to [archaic](https://en.wiktionary.org/wiki/archaic) or [colloquial](https://en.wiktionary.org/wiki/colloquial).	https://en.wiktionary.org/wiki/rustic
		ML_CUSTOM_S	s	_See [_singular_](#singular)._	
		ML_CUSTOM_SCHWEBEABLAUT	Schwebeablaut	In [Indo-European](https://en.wiktionary.org/wiki/Indo-European) languages, especially [Proto-Indo-European](https://en.wiktionary.org/wiki/Proto-Indo-European), the [metathesis](#metathesis) of a [root](#root) vowel ([unmarked](#unmarked): _*e_) and an adjacent [resonant](https://en.wiktionary.org/wiki/resonant) ([sonorant](https://en.wiktionary.org/wiki/sonorant)) _*R_, resulting in two variants of the same root (such as _*CeRC- ~ *CReC-_).	https://en.wiktionary.org/wiki/schwebeablaut
		ML_CUSTOM_SCREEVE	screeve	In [Georgian](https://en.wiktionary.org/wiki/Georgian) grammar, a particular combination of [tense](https://en.wiktionary.org/wiki/tense), [aspect](https://en.wiktionary.org/wiki/aspect) and [mood](https://en.wiktionary.org/wiki/mood).	https://en.wiktionary.org/wiki/screeve
		ML_CUSTOM_SCRIPT	script	A writing system adapted to a particular language or set of languages.	https://en.wiktionary.org/wiki/script
		ML_MORPH-VALUE_SECOND-PERSON	second person	A [grammatical person](#person) that indicates the person or group to whom one is speaking. Examples are the English pronouns [_you_](https://en.wiktionary.org/wiki/you#English) and [_thou_](https://en.wiktionary.org/wiki/thou#English).	https://en.wiktionary.org/wiki/second_person, https://en.wiktionary.org/wiki/2nd_person
		ML_MORPH-VALUE_SECOND-PERSON-OBJECT-FORM	second-person-object form	A type of conjugation in [Hungarian](https://en.wiktionary.org/wiki/Hungarian) (aside from [definite](#definite) and [indefinite](#indefinite)) which indicates a first-person singular subject and a second-person (whether singular or plural, but informally addressed) object, for example [_szeretlek_](https://en.wiktionary.org/wiki/szeretlek#Hungarian) (“I love you”) or [_látlak_](https://en.wiktionary.org/wiki/l%C3%A1tlak#Hungarian) (“I see you”).	
		ML_CUSTOM_SECONDARY-ROOT	secondary root	In Semitic languages, especially Hebrew: A root that is derived from a word that has a different known root.	https://en.wiktionary.org/wiki/secondary_root
		ML_CUSTOM_SEMANTIC-LOAN	semantic loan	A word or expression created by [borrowing](#loanword) a meaning from another language and assigning it to a word or expression which is already considered to have an idiomatic meaning in the borrowing language. Also called semantic calque. For example, the French word [_souris_](https://en.wiktionary.org/wiki/souris#French) (literally “mouse”) was given the additional meaning _[_computer_](https://en.wiktionary.org/wiki/computer#English) [_mouse_](https://en.wiktionary.org/wiki/mouse#English)_ in imitation of English [_mouse_](https://en.wiktionary.org/wiki/mouse#English), which already had both meanings. Semantic loans are distinguished from [calques](#calque) in that calques are not considered to have a pre-existing idiomatic meaning at the time that they are coined.	https://en.wiktionary.org/wiki/semantic_loan
		ML_CUSTOM_SEMANTIC-SHIFT	semantic shift	A usually significant change in the meaning of a word over time, either within the same language or when the word is derived from another language. For example, Latin [_ēgregius_](https://en.wiktionary.org/wiki/egregius#Latin) (literally “standing out from the flock”), meaning “distinguished, outstanding, excellent” is the source of English [_egregious_](https://en.wiktionary.org/wiki/egregious#English), which shifted semantically into meaning “outstandingly bad, shocking”. [semantic](https://en.wiktionary.org/wiki/semantic) [narrowing](https://en.wiktionary.org/wiki/narrowing) A type of semantic shift in which the meaning changes from general to specific ([narrower](#narrow)). [semantic](https://en.wiktionary.org/wiki/semantic) [broadening](https://en.wiktionary.org/wiki/broadening) A type of semantic shift in which the meaning changes from specific to general ([broader](#broad)).	https://en.wiktionary.org/wiki/semantic_shift
		ML_CUSTOM_SEMANTIC-NARROWING	semantic narrowing	A type of semantic shift in which the meaning changes from general to specific ([narrower](#narrow)).	https://en.wiktionary.org/wiki/semantic, https://en.wiktionary.org/wiki/narrowing
		ML_CUSTOM_SEMANTIC-BROADENING	semantic broadening	A type of semantic shift in which the meaning changes from specific to general ([broader](#broad)).	https://en.wiktionary.org/wiki/semantic, https://en.wiktionary.org/wiki/broadening
		ML_CUSTOM_SEMELFACTIVE	semelfactive	A verbal [aspect](#aspect), a subclass of [perfective](#perfective), which denotes a [momentary](https://en.wiktionary.org/wiki/momentary) or [punctual](https://en.wiktionary.org/wiki/punctual) event (e.g. to [sneeze](https://en.wiktionary.org/wiki/sneeze), to [blink](https://en.wiktionary.org/wiki/blink), to [knock](https://en.wiktionary.org/wiki/knock)). In [Slavic languages](https://en.wikipedia.org/wiki/Slavic_languages) such as Russian, often used to express actions performed once.	https://en.wiktionary.org/wiki/semelfactive
		ML_CUSTOM_SEMI-LEARNED-BORROWING	semi-learned borrowing	A [loanword](#loanword) that was borrowed from a [classical language](https://en.wiktionary.org/wiki/classical_language) such as Latin or Sanskrit (especially when borrowed into a descendant of the same language), which has been partly reshaped by later [sound change](#sound_change) or analogy with inherited terms ([adapted](#adapted_borrowing)). / Contrast with [learned borrowings](#learned_borrowing), which have usually not been similarly reshaped ([unadapted](#unadapted_borrowing)), and [inherited](#inherited) terms, which have undergone all the normal sound changes of a language. For example, the Portuguese term [_artigo_](https://en.wiktionary.org/wiki/artigo#Portuguese) (“article”) is a semi-learned borrowing from Latin [_articulus_](https://en.wiktionary.org/wiki/articulus#Latin) (“joint, limb, division”), which was borrowed early enough to undergo later sound changes that [lenited](https://en.wiktionary.org/wiki/lenite) _c_ into _g_ and deleted _l_ between vowels, but did not undergo earlier sound changes, such as lowering short _i_ to _e_. In comparison, [_artelho_](https://en.wiktionary.org/wiki/artelho#Portuguese) (“toe”) is inherited from the same Latin term, and [_artículo_](https://en.wiktionary.org/wiki/art%C3%ADculo#Portuguese) (“[articulus](https://en.wiktionary.org/wiki/articulus)”) is a learned borrowing from the same Latin term.	https://en.wiktionary.org/wiki/semi-learned_borrowing
		ML_PHONOLOGY_SEMIVOWEL	semivowel	A sound which has some qualities of a [consonant](#consonant) and some qualities of a [vowel](#vowel).	https://en.wiktionary.org/wiki/semivowel
		ML_CUSTOM_SENSE	sense	A single [conventional](https://en.wiktionary.org/wiki/conventional) use of a term; the intended meaning that a definition is capturing.	https://en.wiktionary.org/wiki/sense
		ML_POS_SENTENCE-ADVERB	sentence adverb	An adverb that modifies an entire clause or sentence rather than a single word or phrase.	https://en.wiktionary.org/wiki/sentence_adverb
		ML_CUSTOM_SET-PHRASE	set phrase	[Set phrase](https://en.wikipedia.org/wiki/Set_phrase), a common [expression](https://en.wiktionary.org/wiki/expression) (a [phrase](#phrase)) whose [wording](https://en.wiktionary.org/wiki/wording) is not subject to [variation](https://en.wiktionary.org/wiki/variation), or alternately, whose words cannot be replaced by [synonymous](#synonym) words without [compromising](https://en.wiktionary.org/wiki/compromise) the meaning. Set phrases may include [idioms](#idiom), [proverbs](#proverb), and [colloquialisms](#colloquial). For example, _flight simulator_ is a set phrase because it has a special meaning that _flying simulator_ doesn't.	https://en.wiktionary.org/wiki/set_phrase
		ML_CUSTOM_SG	sg.	_See [_singular_](#singular)._	
		ML_CUSTOM_SGV	SGV	_See [_singulative_](#singulative)._	
		ML_CUSTOM_SHORTENING	shortening	A shortened form of a word(s), including [abbreviations](#abbreviation), [acronyms](#acronym), [contractions](#contraction), [initialisms](#initialism), [short forms](#short_form).	https://en.wiktionary.org/wiki/shortening
		ML_CUSTOM_SHORT-FORM	short form	A shortened term which is itself a stand-alone term; e.g. [_Acts_](https://en.wiktionary.org/wiki/Acts#English), a short form used to refer to [_Acts of the Apostles_](https://en.wiktionary.org/wiki/Acts_of_the_Apostles#English).	
		ML_CUSTOM_SIC	sic	A Latin adverb meaning "thus, so". It is traditionally placed inside square brackets and used in quotations to indicate that the preceding is not a copying error, but is in fact a verbatim reflection of the source. (For example, if a source contains a typographical error, someone quoting the source might add [sic] to make clear that the error was in the original source.)	https://en.wiktionary.org/wiki/sic
		ML_CUSTOM_SIGLUM	siglum	A letter or other symbol that stands for a word or name; e.g. [_ꝓ_](https://en.wiktionary.org/wiki/%EA%9D%93#Latin) is a medieval Latin siglum for the word [_pro_](https://en.wiktionary.org/wiki/pro#Latin).	https://en.wiktionary.org/wiki/siglum
		ML_CUSTOM_SIMPLEX	simplex	A simple word, one without [affixes](#affix).	https://en.wiktionary.org/wiki/simplex
		ML_CUSTOM_SINGULARE-TANTUM	singulare tantum	Same as singular only (see below).	https://en.wiktionary.org/wiki/singulare_tantum
		ML_CUSTOM_SINGULAR-ONLY	singular only	A noun (in any specific sense) that has no plural form and is only used with singular verbs. Frequently for mass nouns. / Contrast [**pluralia tantum**](https://en.wiktionary.org/wiki/plurale_tantum).	https://en.wiktionary.org/wiki/singular, https://en.wiktionary.org/wiki/only
		ML_CUSTOM_SINGULATIVE	singulative	The marked singular form of an unmarked [mass noun](#mass_noun).	https://en.wiktionary.org/wiki/singulative
		ML_CUSTOM_SINO-XENIC	Sino-Xenic	Refers to pronunciations in [Japanese](https://en.wiktionary.org/wiki/Japanese), [Korean](https://en.wiktionary.org/wiki/Korean) and [Vietnamese](https://en.wiktionary.org/wiki/Vietnamese) languages (grouped with Chinese as [CJKV](#CJKV)) of terms or components derived from medieval [Chinese](https://en.wiktionary.org/wiki/Chinese).	https://en.wiktionary.org/wiki/Sino-Xenic
		ML_CUSTOM_SL	s.l.	Latin _[_sine_](https://en.wiktionary.org/wiki/sine#Latin) [_locō_](https://en.wiktionary.org/wiki/loco#Latin)_ (literally “without a place”), used to indicate that the place of publication is not stated in a work.	https://en.wiktionary.org/wiki/s.l.#Etymology_2
		ML_CUSTOM_SLANG	slang	Denotes language that is unique to a particular profession or subject, i.e. [jargon](https://en.wiktionary.org/wiki/jargon). Also refers to the specialized language of a social group, sometimes used to make what is said unintelligible to those who are not members of the group, i.e. [cant](https://en.wiktionary.org/wiki/cant). Such language is usually outside of conventional usage, and is mostly inappropriate in [formal](#formal) contexts.	https://en.wiktionary.org/wiki/slang
		ML_CUSTOM_SLAVIC-FIRST-PALATALIZATION	Slavic first palatalization	A specific occurrence of [palatalization](#palatalization) that occurred in the [Proto-Slavic language](https://en.wikipedia.org/wiki/Proto-Slavic_language), in which the [velar](#velar) consonants *_k_ *_g_ *_x_ when followed by any of the [front vowels](#front_vowel) *_e_ *_ě_ *_ь_ *_i_ became the sounds *_č_ *_ž_ *_š_, respectively. The Slavic first palatalization is still an active process in many modern [Slavic languages](https://en.wikipedia.org/wiki/Slavic_languages). For example, before certain suffixes in Russian, the consonants к г х ц become ч ж ш ч respectively. Other [Slavic languages](https://en.wikipedia.org/wiki/Slavic_languages) behave similarly.	https://en.wikipedia.org/wiki/Slavic_first_palatalization
		ML_CUSTOM_SLAVIC-PROGRESSIVE-PALATALIZATION	Slavic progressive palatalization	A specific occurrence of [palatalization](#palatalization) that occurred in the [Proto-Slavic language](https://en.wikipedia.org/wiki/Proto-Slavic_language), in which the [velar](#velar) consonants _*k *g *x_ when preceded by either of the [front vowels](#front_vowel) _*ь *i_ (possibly with an intervening _n_) became the sounds _*c dz s/š_, respectively, with _s_ occurring in East and South Slavic but _š_ occurring in West Slavic.	https://en.wikipedia.org/wiki/Slavic_progressive_palatalization
		ML_CUSTOM_SN	s.n.	Latin _[_sine_](https://en.wiktionary.org/wiki/sine#Latin) [_nōmine_](https://en.wiktionary.org/wiki/nomine#Latin)_ (literally “without a name”), used to indicate that the name of the publisher is not stated in a work.	https://en.wiktionary.org/wiki/s.n.
		ML_CUSTOM_SNOWCLONE	snowclone	A type of [cliché](https://en.wiktionary.org/wiki/clich%C3%A9#English) which uses an old [idiom](#idiom) formulaically in a new context. / See also [_Appendix:English snowclones_](https://en.wiktionary.org/wiki/Appendix:English_snowclones).	https://en.wiktionary.org/wiki/snowclone
