WikiData QID	parent	ML_ID	label	description	wiktionary
		ML_CUSTOM_DESCRIPTIVE-COMPOUND	descriptive compound	A [nominal](#nominal) [compound](#compound) in which one part modifies the other, where both parts refer to the intended meaning of the compound as a whole. Also known as a [_karmadharaya_](https://en.wiktionary.org/wiki/karmadharaya) compound. The intended meaning of the compound as a whole is an extension of the sum-of-parts meaning of the compound. Examples in English are "[blackboard](https://en.wiktionary.org/wiki/blackboard)" (a type of board which is [often] black) and "[houseboat](https://en.wiktionary.org/wiki/houseboat)" (a boat which is also a house). / Contrast [determinative](#determinative) compounds, where the modified component but not the modifier refer to the intended meaning as a whole, as in "[rainbow](https://en.wiktionary.org/wiki/rainbow)" and "[footstool](https://en.wiktionary.org/wiki/footstool)". Descriptive compounds are a subtype of [endocentric](#endocentric) compounds, which are in turn contrasted with [exocentric](#exocentric) and [coordinative](#coordinative) compounds.	https://en.wiktionary.org/wiki/descriptive, https://en.wiktionary.org/wiki/compound
		ML_CUSTOM_DESIDERATIVE	desiderative	A verb form indicating a wish.	https://en.wiktionary.org/wiki/desiderative
		ML_POS_DETERMINATE-VERB	determinate verb	In the [Slavic languages](https://en.wikipedia.org/wiki/Slavic_languages), another term for [_unidirectional verb_](#unidirectional_verb).	https://en.wiktionary.org/wiki/determinate_verb
		ML_CUSTOM_DETERMINATIVE-COMPOUND	determinative compound	A [nominal](#nominal) [compound](#compound) in which one part modifies the other, where the modified component (but not the modifier) refers to the intended meaning of the compound as a whole. Also known as a [_tatpurusa_](https://en.wiktionary.org/wiki/tatpurusa) compound. Examples in English are "[rainbow](https://en.wiktionary.org/wiki/rainbow)" (a type of [bow](https://en.wiktionary.org/wiki/bow), caused by the rain) and "[footstool](https://en.wiktionary.org/wiki/footstool)" (a type of [stool](https://en.wiktionary.org/wiki/stool), intended for one's feet). / Contrast [descriptive](#descriptive) compounds, where both the modifier and modified component refer to the intended meaning as a whole, as in "[blackboard](https://en.wiktionary.org/wiki/blackboard)" or "[houseboat](https://en.wiktionary.org/wiki/houseboat)". Determinative compounds are a subtype of [endocentric](#endocentric) compounds, which in turn are contrasted with [exocentric](#exocentric) and [coordinative](#coordinative) compounds.	https://en.wiktionary.org/wiki/determinative, https://en.wiktionary.org/wiki/compound
		ML_POS_DEVERBAL	deverbal	A word, often a [substantive](#substantive), derived from a [verb](#verb). / Contrast [_denominal_](#denominal).	https://en.wiktionary.org/wiki/deverbal
		ML_CUSTOM_DIACHRONY	diachrony	A viewpoint of analysis of a language or phrase within a language which considers the [historical changes](https://en.wiktionary.org/wiki/historical_linguistics) over time which have shaped its state at a given later time. The term is typically used to contrast with [_synchrony_](#synchrony).	https://en.wiktionary.org/wiki/diachrony
		ML_CUSTOM_DIACRITIC	diacritic	A diacritic – also diacritical mark, diacritical point, diacritical sign, or an accent – is a [glyph](#glyph) added to a letter, or basic glyph. Examples: [acute](#acute) ( ´ ), double acute ( ˝ ), [breve](#breve) ( ˘ ), inverted breve ( ̑ ), [cedilla](#cedilla) ( ¸ ), [diaeresis](#diaeresis)/[umlaut](#umlaut) ( ¨ ), [macron](#macron) ( ¯ ), [overring](https://en.wiktionary.org/wiki/overring) ( ˚ ), [perispomene](#perispomene) ( ͂ ), etc. The main use of a diacritical mark is to change the sound-values of the letters or cadence of a word to which they are added. Examples are the diaereses in the borrowed French words [_naïve_](https://en.wiktionary.org/wiki/na%C3%AFve#English) and [_Noël_](https://en.wiktionary.org/wiki/No%C3%ABl#English), which show that the vowel with the diaeresis mark is pronounced separately from the preceding vowel; the acute and [grave](#grave) accents, which can indicate that a final vowel is to be pronounced, as in [_saké_](https://en.wiktionary.org/wiki/sak%C3%A9#English) and poetic _breathèd_; and the cedilla under the ⟨c⟩ in the borrowed French word [_façade_](https://en.wiktionary.org/wiki/fa%C3%A7ade#English), which shows it is pronounced /s/ rather than /k/.	https://en.wiktionary.org/wiki/diacritic
		ML_CUSTOM_DIALECTAL	dialectal	Of or relating to a [dialect](https://en.wikipedia.org/wiki/dialect) (which is, for the purposes of [Wiktionary's labels](https://en.wiktionary.org/wiki/Wiktionary:Context_labels), synonymous with [variety](#variety)).	https://en.wiktionary.org/wiki/dialectal
		ML_POS_DISJUNCTIVE-PRONOUN	disjunctive pronoun	A [pronoun](#pronoun) not used in immediate conjunction with the [verb](#verb) of which it is the [subject](#subject) (e.g. Spanish [_mí_](https://en.wiktionary.org/wiki/m%C3%AD#Spanish)).	https://en.wiktionary.org/wiki/disjunctive, https://en.wiktionary.org/wiki/pronoun
		ML_CUSTOM_DISPLACED	displaced	Of an older word: having been replaced by a newer word.	https://en.wiktionary.org/wiki/displace
		ML_CUSTOM_DISSIMILATION	dissimilation	A phonological process whereby one of a pair of similar sounds within a word or phrase becomes dissimilar: for example, the shift l…l > r…l in the derivation of Middle French [_coronnel_](https://en.wiktionary.org/wiki/coronnel#Middle_French) from Old Italian [_colonnello_](https://en.wiktionary.org/wiki/colonnello#Italian). It has an opposite effect to [assimilation](#assimilation).	https://en.wiktionary.org/wiki/dissimilation
		ML_CUSTOM_DISTAL	distal	Indicates distance from the speaker. / Contrast [_proximal_](#proximal).	https://en.wiktionary.org/wiki/distal
		ML_POS_DITRANSITIVE-VERB	ditransitive verb	(of a verb) taking two objects, such as [_give_](https://en.wiktionary.org/wiki/give#English) in “Give me the ball” (where [_me_](https://en.wiktionary.org/wiki/me#English) is an [indirect object](#indirect_object) and _[_the_](https://en.wiktionary.org/wiki/the#English) [_ball_](https://en.wiktionary.org/wiki/ball#English)_ is a [direct object](#direct_object)). Compare [intransitive](#intransitive_verb), [transitive](#transitive_verb), and [ambitransitive](#ambitransitive_verb) verbs.	https://en.wiktionary.org/wiki/ditransitive_verb
		ML_CUSTOM_DOUBLET	doublet	One of two (or more) words in a language that have the same [etymological](#etymology) root (as in [etymon](https://en.wiktionary.org/wiki/etymon), not root morphemes like Proto-Indo-European roots) but in the modern language have different [phonological](https://en.wiktionary.org/wiki/phonological) forms. Doublets can come about e.g., as [loanwords](#loanword) from two different but related languages, as loanwords acquired from the same language at two different stages, as one loanword from a related language plus its native [cognate](#cognate), or as derivatives formed at two different stages in the history of a language. For example [_lever_](https://en.wiktionary.org/wiki/lever#Noun) and [_levator_](https://en.wiktionary.org/wiki/levator#Noun) are doublets (more at [Category:English doublets](https://en.wiktionary.org/wiki/Category:English_doublets)). / Compare [piecewise doublet](#piecewise_doublet).	https://en.wiktionary.org/wiki/doublet
		ML_POS_DUMMY-PRONOUN	dummy pronoun	A [pronoun](#pronoun) that has no referent. For instance, [_it_](https://en.wiktionary.org/wiki/it#English) in _it is good to know that you are okay_ is a dummy [subject](#subject). It is used in order to provide the verb [_is_](https://en.wiktionary.org/wiki/is#English) with a syntactic subject, because English does not allow a [null subject](https://en.wikipedia.org/wiki/null-subject_language).	https://en.wikipedia.org/wiki/dummy_pronoun
		ML_CUSTOM_DVANDVA	dvandva	Another term for a [_coordinative_](#coordinative) compound. / Contrast [bahuvrihi](#bahuvrihi), [tatpurusa](#tatpurusa) and [karmadharaya](#karmadharaya).	https://en.wiktionary.org/wiki/dvandva
		ML_CUSTOM_ED	ed.	[Editor](https://en.wiktionary.org/wiki/editor) (or sometimes "edition"). This abbreviation is often used in attributing quotations; the editor of a compilation is generally the individual in charge of selecting what works to include.	
		ML_CUSTOM_EGGCORN	eggcorn	A word or phrase that sounds like and is mistakenly used in a seemingly logical or plausible way for another word or phrase either on its own or as part of a set expression.	https://en.wiktionary.org/wiki/eggcorn
		ML_CUSTOM_ELATIVE	elative	In [Semitic](https://en.wiktionary.org/wiki/Semitic) languages, a stage of gradation that can be used both for a [superlative](https://en.wiktionary.org/wiki/superlative) and [comparative](https://en.wiktionary.org/wiki/comparative). (See also [_degrees of comparison_](#degrees_of_comparison).)	https://en.wiktionary.org/wiki/elative
		ML_MORPH-VALUE_ELATIVE-CASE	elative case	A [case](#case) which expresses "moving out of".	https://en.wiktionary.org/wiki/elative_case
		ML_CUSTOM_ELISION	elision	The removal of a [phoneme](#phoneme) or sequence of phonemes from a word, particularly at the beginning or end.	https://en.wiktionary.org/wiki/elision
		ML_CUSTOM_ELONGATED	elongated	With [letters](https://en.wiktionary.org/wiki/letter) added for [emphasis](https://en.wiktionary.org/wiki/emphasis), like "stoooop!" Usually this is [nonstandard](https://en.wiktionary.org/wiki/nonstandard) writing, but in some uses, such as in interjections, this is normal: "awwwww!", "shhhh!"	https://en.wiktionary.org/wiki/elongated
		ML_CUSTOM_EMPHATIC	emphatic	Taking particular stress. English's [reflexive](#reflexive) pronouns double as emphatic ones, as in "I myself have not seen it" (where "myself" emphasizes the role of the speaker); some other languages (such as Greek) have emphatic pronouns that they distinguish from [_weak_](#weak_pronoun) or [_clitic_](#clitic) pronouns.	https://en.wiktionary.org/wiki/emphatic
		ML_CUSTOM_ENCLISIS	enclisis	The phonetic joining of a word with the preceding word. In modern (and ancient) Greek this may result in an extra stress on the first word, thus, for example: _το όνομα μου είναι_ (to ónoma mou eínai) _becomes_ _το όνομά μου είναι_ (to ónomá mou eínai)	https://en.wiktionary.org/wiki/enclisis
		ML_CUSTOM_ENDONYM	endonym	A name used by a group or category of people to refer to themselves or their language (contrast [exonym](#exonym)). Also called [autonym](https://en.wiktionary.org/wiki/autonym) or [selfname](https://en.wiktionary.org/wiki/selfname).	https://en.wiktionary.org/wiki/endonym
		ML_CUSTOM_ENDOCENTRIC-COMPOUND	endocentric compound	A [nominal](#nominal) [compound](#compound) in which one part modifies the other, where the modified compound refers to the intended meaning of the compound as a whole. Examples in English are "[blackboard](https://en.wiktionary.org/wiki/blackboard)" (a type of [board](https://en.wiktionary.org/wiki/board)), "[houseboat](https://en.wiktionary.org/wiki/houseboat)" (a type of [boat](https://en.wiktionary.org/wiki/boat)), "[rainbow](https://en.wiktionary.org/wiki/rainbow)" (a type of [bow](https://en.wiktionary.org/wiki/bow)) and "[footstool](https://en.wiktionary.org/wiki/footstool)" (a type of stool). Endocentric compounds are categorized into two subtypes, [descriptive](#descriptive) compounds (where the modifier also refers to the intended meaning of the compound as a whole, as in [blackboard](https://en.wiktionary.org/wiki/blackboard) and [houseboat](https://en.wiktionary.org/wiki/houseboat)) and [determinative](#determinative) compounds (where the modifier does not refer to the intended meaning of the compound as a whole, as in [rainbow](https://en.wiktionary.org/wiki/rainbow) and [footstool](https://en.wiktionary.org/wiki/footstool)). For example, a [houseboat](https://en.wiktionary.org/wiki/houseboat) is a type of [house](https://en.wiktionary.org/wiki/house) as well as a type of [boat](https://en.wiktionary.org/wiki/boat), and a [blackboard](https://en.wiktionary.org/wiki/blackboard) is (usually) [black](https://en.wiktionary.org/wiki/black). However, a [rainbow](https://en.wiktionary.org/wiki/rainbow) is not a type of [rain](https://en.wiktionary.org/wiki/rain) (rather it is a [bow](https://en.wiktionary.org/wiki/bow) that is caused _by_ the rain), and similarly a [footstool](https://en.wiktionary.org/wiki/footstool) is not a type of [foot](https://en.wiktionary.org/wiki/foot) (it is a stool intended _for_ the feet). Endocentric compounds are contrasted with [exocentric](#exocentric) and [coordinative](#coordinative) compounds.	https://en.wiktionary.org/wiki/endocentric, https://en.wiktionary.org/wiki/compound
		ML_CUSTOM_ENPR	enPR	Wiktionary's [English Phonemic Representation](https://en.wiktionary.org/wiki/Wiktionary:English_Phonemic_Representation) system. Details in the [English pronunciation key](https://en.wiktionary.org/wiki/Appendix:English_pronunciation).	
		ML_CUSTOM_ENTRY	entry	Each language section on a Wiktionary page. For example, the page titled "[invention](https://en.wiktionary.org/wiki/invention)" contains two entries: one for English and one for French.	
		ML_CUSTOM_EPENTHESIS	epenthesis	The insertion of a [phoneme](#phoneme), letter, or [syllable](#syllable) into a word, usually to satisfy the phonological constraints of a language or poetic context. In careful use epenthesis only refers to insertions in the middle of a word: cf. [prothesis](#prothesis), [paragoge](#paragoge).	https://en.wiktionary.org/wiki/epenthesis
		ML_CUSTOM_EPICENE	epicene	Having a single form for both male and female referents.	https://en.wiktionary.org/wiki/epicene
		ML_CUSTOM_EPONYM	eponym	A word formed from a real or fictive person’s name. Compare [toponym](#toponym), a word derived from a place name.	https://en.wiktionary.org/wiki/eponym
		ML_CUSTOM_EPONYMOUS	eponymous	Using its own name as a title for a work of art.	https://en.wiktionary.org/wiki/eponymous
		ML_CUSTOM_EQUATIVE	equative	A construction showing an equal quality; for example, the equative of [_happy_](https://en.wiktionary.org/wiki/happy#English) is _as happy as_. In some languages, such as Welsh and Old Irish, the equative is a distinct form of the adjective.	https://en.wiktionary.org/wiki/equative
		ML_MORPH-VALUE_ERGATIVE-CASE	ergative case	A [case](#case) used in some languages, which marks the [subject](#subject) of a [transitive verb](#transitive_verb), but not the subject of an [intransitive verb](#intransitive_verb).	https://en.wiktionary.org/wiki/ergative_case
		ML_POS_ERGATIVE-VERB	ergative verb	A verb that can be transitive or intransitive, where the intransitive [subject](#subject) is the [patient](https://en.wiktionary.org/wiki/patient#Noun), the same role as the transitive object. Essentially, an ergative is an intransitive verb that is its own [causative](#causative) when used transitively. For example, [_break_](https://en.wiktionary.org/wiki/break#English) is an ergative verb. The same thing happens to the window in "The window broke" (subject) as in "I broke the window" ([direct object](#direct_object)), but in the second example there is also an [agent](#agent) which causes the window to break.	https://en.wiktionary.org/wiki/ergative_verb
		ML_CUSTOM_ETYMOLOGY	etymology	An account of the origin and historical development of a word.	https://en.wiktionary.org/wiki/etymology
		ML_CUSTOM_ETYMON	etymon	The source word of a given word.	https://en.wiktionary.org/wiki/etymon
		ML_CUSTOM_EXCESSIVE-SPELLING	excessive spelling	In languages with [matres lectionis](https://en.wiktionary.org/wiki/mater_lectionis) ([consonant](#consonant) letters representing [vowels](#vowel)), a [plene spelling](#plene_spelling) form that includes more of those additional letters that the standard spelling prescribes. The extreme opposite of [defective spelling](#defective_spelling).	
		ML_CUSTOM_EXCRESCENT	excrescent	A sound in a word without [etymological](#etymology) reason, added for articulatory purposes.	https://en.wiktionary.org/wiki/excrescent
		ML_CUSTOM_EXOCENTRIC-COMPOUND	exocentric compound	A [nominal](#nominal) [compound](#compound) in which one part modifies the other and neither part alone conveys the intended meaning. An example in English is "[houndstooth](https://en.wiktionary.org/wiki/houndstooth)" (i.e. "resembling a hound's tooth"; neither component refers to fabric). Also known as a _[_bahuvrihi_](#bahuvrihi) [_compound_](#compound)_. / Contrast [endocentric](#endocentric) (with its subtypes [determinative](#determinative) and [descriptive](#descriptive)) and [coordinative](#coordinative).	https://en.wiktionary.org/wiki/exocentric, https://en.wiktionary.org/wiki/compound
		ML_CUSTOM_EXONYM	exonym	A name for a place, people or language used by foreigners instead of the native-language version (the [endonym](#endonym)).	https://en.wiktionary.org/wiki/exonym
		ML_CUSTOM_EXPLETIVE	expletive	A [vulgar](#vulgar) term, an [intensifier](#intensifier), or a word without meaning added to fill a syntactic position.	https://en.wiktionary.org/wiki/expletive
		ML_CUSTOM_EXPLETIVE-INFIXATION	expletive infixation	[Tmesis](#tmesis) accompanied by insertion of an expletive or invective between the divided parts, e.g., [abso-bloody-lutely](https://en.wiktionary.org/wiki/abso-bloody-lutely).	https://en.wiktionary.org/wiki/infixation
		ML_CUSTOM_EXPRESSIVE-TERM	expressive term	A term with additional expressive content compared with the basic meaning of the term. This term is common in Slavic lexicography and is found in most Czech, Slovak and Polish dictionaries, but there is no exact equivalent in English lexicography. The closest equivalents might be a combination of _colloquial_ and either _endearing_ or _pejorative_, as the case may be.	https://en.wiktionary.org/wiki/expressive, https://en.wiktionary.org/wiki/term
		ML_CUSTOM_EYE-DIALECT	eye dialect	The deliberate use of misspellings to indicate that a character speaks in a colloquial, non-standard, or uneducated way, even though the misspellings indicate a standard pronunciation; the idea is that the spelling represents how the character would spell the words if they were asked to write them down.	https://en.wiktionary.org/wiki/eye_dialect
		ML_CUSTOM_EZAFE-OR-EZFE	ezafe or ezâfe	In Persian: [_اِضافِه_](https://en.wiktionary.org/wiki/%D8%A7%D8%B6%D8%A7%D9%81%D9%87#Persian) (ezâfe). The [possessive](https://en.wiktionary.org/wiki/possessive) or [genitive](https://en.wiktionary.org/wiki/genitive) construction in Persian. See also [ʾiḍāfa](https://en.wiktionary.org/wiki/%CA%BEi%E1%B8%8D%C4%81fa).	https://en.wiktionary.org/wiki/ezafe, https://en.wiktionary.org/wiki/ez%C3%A2fe
		ML_CUSTOM_F	f	_See [_feminine_](#feminine)._	
		ML_CUSTOM_FPL	fpl	[Feminine](#feminine) [plural](#plural); of feminine gender and plural number.	
		ML_POS_FACTITIVE-VERB	factitive verb	A transitive verb that is derived from an adjective or noun, and expresses the act of making someone/something have the properties (or have more of the properties) of the base adjective or noun. Examples in English include: [_shorten_](https://en.wiktionary.org/wiki/shorten#English) (make [_shorter_](https://en.wiktionary.org/wiki/shorter#English)), [_strengthen_](https://en.wiktionary.org/wiki/strengthen#English) (make [_stronger_](https://en.wiktionary.org/wiki/stronger#English)) and [_enslave_](https://en.wiktionary.org/wiki/enslave#English) (make a [_slave_](https://en.wiktionary.org/wiki/slave#English) of). / Compare [**causative verbs**](#causative), which are similar but are derived from other verbs. (Not to be confused with [factive](https://en.wiktionary.org/wiki/factive) verbs.)	https://en.wiktionary.org/wiki/factitive
		ML_CUSTOM_FALSE-COGNATE	false cognate	A word in a language that bears a [phonetic](https://en.wiktionary.org/wiki/phonetic) and [semantic](https://en.wiktionary.org/wiki/semantic) resemblance to a word in another or the same language but is not [etymologically](https://en.wiktionary.org/wiki/etymology) related to it and thus not a true [cognate](#cognate). Examples include English [_day_](https://en.wiktionary.org/wiki/day#English) and Portuguese [_dia_](https://en.wiktionary.org/wiki/dia#Portuguese); English [_dog_](https://en.wiktionary.org/wiki/dog#English) and Mbabaram [_dog_](https://en.wiktionary.org/wiki/dog#Mbabaram); German [_Feuer_](https://en.wiktionary.org/wiki/Feuer#German) and French [_feu_](https://en.wiktionary.org/wiki/feu#French) (both meaning “fire”); Malay [_dua_](https://en.wiktionary.org/wiki/dua#Malay) and Sanskrit [_द्व_](https://en.wiktionary.org/wiki/%E0%A4%A6%E0%A5%8D%E0%A4%B5#Sanskrit) (dva) (both meaning “two”). / Compare [**false friend**](#false_friend).	https://en.wiktionary.org/wiki/false_cognate
		ML_CUSTOM_FALSE-FRIEND	false friend	A word in a language that bears a phonetic resemblance to a word in another language, often because of a common etymology, but has a different meaning. Examples include English [_parent_](https://en.wiktionary.org/wiki/parent#English) and Portuguese [_parente_](https://en.wiktionary.org/wiki/parente#Portuguese) (“relative”); English [_embarrassed_](https://en.wiktionary.org/wiki/embarrassed#English) and Spanish [_embarazada_](https://en.wiktionary.org/wiki/embarazada#Spanish) (“pregnant”). / Compare [**false cognate**](#false_cognate).	https://en.wiktionary.org/wiki/false_friend
		ML_CUSTOM_FAMILIAR	familiar	Describes a context where those conversing, through speech or written word, are well acquainted with one another and in casual situations often use more [**informal**](#informal) or [**colloquial**](#colloquial) terms to communicate. Many languages have [inflections](#inflection) and [pronouns](#pronoun) dedicated specifically to forms that are familiar, in contrast with their [polite](#polite) counterparts.	https://en.wiktionary.org/wiki/familiar
		ML_CUSTOM_FIGURATIVE	figurative	Not [literal](#literal). Of [figures of speech](https://en.wiktionary.org/wiki/figure_of_speech), words or expressions used as [metaphors](#metaphorical) or [similes](#simile), e.g. saying that a greedy person is a pig or is like a pig, or as [metonyms](#metonym), e.g. using [_crown_](https://en.wiktionary.org/wiki/crown#English) to refer to the monarchy.	https://en.wiktionary.org/wiki/figurative
		ML_MORPH-VALUE_FIRST-PERSON	first person	A [grammatical person](#person) that indicates the speaker him/her/itself, or a group to which the speaker belongs. Examples are the English pronouns [_I_](https://en.wiktionary.org/wiki/I#English) and [_we_](https://en.wiktionary.org/wiki/we#English).	https://en.wiktionary.org/wiki/first_person, https://en.wiktionary.org/wiki/1st_person
		ML_CUSTOM_FL	fl.	[Floruit](https://en.wiktionary.org/wiki/floruit) (Latin for "he/she flourished"). Used when the exact dates of a person's birth and death are unknown to denote a date or period during which the person was known to have been alive or active.	https://en.wiktionary.org/wiki/fl.
		ML_CUSTOM_FOCUS	focus	An adverb that indicates focus within the sentence.	https://en.wiktionary.org/wiki/focus
		ML_CUSTOM_FOLK-ETYMOLOGY	folk etymology	Re-interpretation of the form or meaning of an archaic, foreign, or otherwise unfamiliar word as resembling more familiar words or morphemes. Compare [**reanalysis**](#reanalysis).	https://en.wiktionary.org/wiki/folk_etymology
		ML_CUSTOM_FORMAL	formal	Describes word choice and [syntax](https://en.wiktionary.org/wiki/syntax) which is appropriate mainly in formal contexts, such as in official or legal documents, essays, and sometimes when talking with one's superiors or elders. [**Informal**](#informal) terms, frequently those that originate through casual speech ([**colloquial**](#colloquial)), are often inappropriate in formal contexts. See also [_higher register_](#higher_register).	https://en.wiktionary.org/wiki/formal
		ML_CUSTOM_FOSSIL-WORD	fossil word	A word that is broadly [obsolete](#obsolete), but remains in currency because it is contained within an [idiom](#idiom) that is still in use; a word that has been _[_fossilized_](#fossilize)_.	https://en.wiktionary.org/wiki/fossil_word
		ML_CUSTOM_FOSSILISATION	fossilisation	The process by which a word, [morpheme](#morpheme) or [feature](https://en.wiktionary.org/wiki/feature) of a language ceases to have independent function but is retained as a fixed component of something else within the language, becoming a "[fossil](https://en.wiktionary.org/wiki/fossil)". An example of a fossil element in English is the plural [_-en_](https://en.wiktionary.org/wiki/-en#English:_plural_noun) in some words such as [_children_](https://en.wiktionary.org/wiki/children#English), [_brethren_](https://en.wiktionary.org/wiki/brethren#English) and [_oxen_](https://en.wiktionary.org/wiki/oxen#English); this suffix formerly applied to a much broader class of nouns. For instances of fossilization that appear as standalone [words](#words), see _[_fossil word_](#fossil_word)_ above. Compare un-[_productive_](#productive). Related to [diachrony](#diachrony) and [synchrony](#synchrony).	https://en.wiktionary.org/wiki/fossilisation, https://en.wiktionary.org/wiki/fossilization
		ML_CUSTOM_FREQUENTATIVE	frequentative	Expressing [repetition](https://en.wiktionary.org/wiki/repetition) of an action.	https://en.wiktionary.org/wiki/frequentative
