term	definition	term_links	wikidata_qid
syllogism	A type of [valid](https://en.wiktionary.org/wiki/valid) argument that states if the first two claims are true, then the conclusion is true. For example, "(claim 1) People are mortal; (claim 2) Bob is a person. Therefore, (claim 3) Bob is mortal." Started by [Aristotle](https://en.wiktionary.org/wiki/Aristotle).	https://en.wiktionary.org/wiki/syllogism	
syllogistic logic	See scientific reasoning.	https://en.wiktionary.org/wiki/syllogistic_logic	
symbol	A visual or metaphorical representation of an idea or concept.	https://en.wiktionary.org/wiki/symbol	
symbolic inducement	Term coined by [Kenneth Burke](https://en.wikipedia.org/wiki/Kenneth_Burke) to refer to rhetoric.	https://en.wiktionary.org/wiki/symbolic_inducement	
sympheron	From [Ancient Greek](https://en.wikipedia.org/wiki/Ancient_Greek). Path that is to one's advantage.	https://en.wiktionary.org/wiki/sympheron	
synchysis	Word order confusion within a sentence.	https://en.wiktionary.org/wiki/synchysis	
syncope	The omission of letters from the middle of a word, usually replaced by an [apostrophe](https://en.wiktionary.org/wiki/apostrophe).	https://en.wiktionary.org/wiki/syncope	
synecdoche	A rhetorical device were one part of an object is used to represent the whole.	https://en.wiktionary.org/wiki/synecdoche	
tapinosis	Language or an [epithet](https://en.wiktionary.org/wiki/epithet) that is debasing. This term is synonymous with [meiosis](https://en.wiktionary.org/wiki/meiosis).	https://en.wiktionary.org/wiki/tapinosis	
taste	A learned admiration for things of beauty.	https://en.wiktionary.org/wiki/taste	
tautologia	The same idea repeated in different words.	https://en.wiktionary.org/wiki/tautologia	
taxis	The distribution of a proper adjunct to every subject.	https://en.wiktionary.org/wiki/taxis	
techne	[Ancient Greek](https://en.wikipedia.org/wiki/Ancient_Greek) for a true art.	https://en.wiktionary.org/wiki/techne	
terministic screens	Term coined by [Kenneth Burke](https://en.wikipedia.org/wiki/Kenneth_Burke) to explain the way in which the world is viewed when taking languages and words into consideration.	https://en.wiktionary.org/wiki/terministic_screens	
theme	The basic principle pulled from the Bible in order to create a sermon.	https://en.wiktionary.org/wiki/theme	
thesis	The major claim or premise made in an argument to be proved or dis-proved.	https://en.wiktionary.org/wiki/thesis	
thesmos	From [Ancient Greek](https://en.wikipedia.org/wiki/Ancient_Greek). The law that comes from the authority of kings.	https://en.wiktionary.org/wiki/thesmos	
tone	The author's voice in an essay through use of figurative language or a style of enunciation in writing (also known as a [diction](https://en.wiktionary.org/wiki/diction)). The way the author expresses themself out loud or through a character.	https://en.wiktionary.org/wiki/tone	
topical systems	Methods for finding arguments.	https://en.wiktionary.org/wiki/topical_systems	
topographia	The description of a place.	https://en.wiktionary.org/wiki/topographia	
topothesia	The description of an imaginary or non-existent place.	https://en.wiktionary.org/wiki/topothesia	
Topos	A line or specific style of argument.	https://en.wiktionary.org/wiki/Topos	
Toulmin model	A method of diagraming arguments created by Stephen Toulmin that identifies such components as [backing](https://en.wiktionary.org/wiki/backing), [claim](https://en.wiktionary.org/wiki/claim), [data](https://en.wiktionary.org/wiki/data), [qualifier](https://en.wiktionary.org/wiki/qualifier), [rebuttal](https://en.wiktionary.org/wiki/rebuttal), and warrant.	https://en.wiktionary.org/wiki/Toulmin_model	
transgression	Reading a text and looking for the deeper meanings instead of the obvious ones.	https://en.wiktionary.org/wiki/transgression	
translative issue	Dealing with procedure of an ensuing case.	https://en.wiktionary.org/wiki/translative_issue	
tricolon	The pattern of three phrases in parallel, found commonly in Western writing after [Cicero](https://en.wikipedia.org/wiki/Cicero). For example, the kitten had white fur, blue eyes, and a pink tongue.	https://en.wiktionary.org/wiki/tricolon	
trivium	From [Latin](https://en.wikipedia.org/wiki/Latin). Grammar, rhetoric, and logic taught in schools during the medieval period.	https://en.wiktionary.org/wiki/trivium	
tropes	Figure of speech that uses a word aside from its literal meaning.	https://en.wiktionary.org/wiki/tropes	
understatement	A form of irony, also called [litotes](https://en.wiktionary.org/wiki/litotes), in which something is represented as less than it really is, with the intent of drawing attention to and emphasizing the opposite meaning.	https://en.wiktionary.org/wiki/understatement	
universal audience	An audience consisting of all humankind (most specifically of adult age and normal mental capacity).	https://en.wiktionary.org/wiki/universal_audience	
uomo universale	The universal man.	https://en.wiktionary.org/wiki/uomo_universale	
utterance	Statement that could contain meaning about one's own person.	https://en.wiktionary.org/wiki/utterance	
validity	Apprehension over the structure of an argument.	https://en.wiktionary.org/wiki/validity	
validity claim	Claiming to have made a correct statement.	https://en.wiktionary.org/wiki/validity_claim	
verba	From [Latin](https://en.wikipedia.org/wiki/Latin). The part of an argument that advances the subject matter.	https://en.wiktionary.org/wiki/verba	
visual rhetoric	A theoretical framework describing how visual images communicate, as opposed to aural or verbal messages.	https://en.wiktionary.org/wiki/visual_rhetoric	
vir bonus beni dicendi	From [Latin](https://en.wikipedia.org/wiki/Latin). The good man speaking well.	https://en.wiktionary.org/wiki/vir_bonus_beni_dicendi	
vita activa	A life lived in active involvement in the political arena.	https://en.wiktionary.org/wiki/vita_activa	
warrant	term used by [Stephen Toulmin](https://en.wikipedia.org/wiki/Stephen_Toulmin) to establish a link between data and a claim.	https://en.wiktionary.org/wiki/warrant	
ways and means	One of the five main matters that [Aristotle](https://en.wikipedia.org/wiki/Aristotle) claims political speakers make speeches on. It consists of the speaker's country's revenue and sources, as well as the expenditures of the country.	https://en.wiktionary.org/wiki/ways_and_means	
zeugma	From [Ancient Greek](https://en.wikipedia.org/wiki/Ancient_Greek) [_ζεῦγμα_](https://en.wiktionary.org/wiki/%CE%B6%CE%B5%E1%BF%A6%CE%B3%CE%BC%CE%B1#Ancient_Greek) (zeûgma, “[yoking](https://en.wiktionary.org/wiki/yoke)”). A figure of speech in which one word applies to two others in different senses of that word, and in some cases only logically applies to one of the other two words. This is a similar concept to [syllepsis](https://en.wiktionary.org/wiki/syllepsis).	https://en.wiktionary.org/wiki/zeugma	
