term	definition	term_links	wikidata_qid
accumulatio	The emphasis or summary of previously made points or inferences by excessive praise or accusation.	https://en.wiktionary.org/wiki/accumulatio	
acutezza	Wit or wordplay used in rhetoric.	https://en.wiktionary.org/wiki/acutezza	
adjunction	When a verb is placed at the beginning or the end of a sentence instead of in the middle. For example (from [_Rhetorica ad Herennium_](https://en.wikipedia.org/wiki/Rhetorica_ad_Herennium)), "At the beginning, as follows: 'Fades physical beauty with disease or age.' At the end, as follows: 'Either with disease or age physical beauty fades.'"	https://en.wiktionary.org/wiki/adjunction	
aesthetics	The examination of symbolic expression to determine its rhetorical possibilities.	https://en.wiktionary.org/wiki/aesthetics	
aetiologia	Giving a cause or a reason.	https://en.wiktionary.org/wiki/aetiologia	
affectus	A term used by the Italian Humanists of the Renaissance to describe the source of emotions or passions in the human mind.	https://en.wiktionary.org/wiki/affectus	
alloiosis	Interchange of characteristics.	https://en.wiktionary.org/wiki/alloiosis	
alloisis	The breaking down of a subject into its alternatives.	https://en.wiktionary.org/wiki/alloisis	
ambigua	An ambiguous statement used in making puns.	https://en.wiktionary.org/wiki/ambigua	
amplificatio	An all-purpose term for all the ways an argument can be expanded and enhanced.	https://en.wiktionary.org/wiki/amplificatio	
amplification	The act and the means of extending thoughts or statements to increase rhetorical effect, to add importance, or to make the most of a thought or circumstance.	https://en.wiktionary.org/wiki/amplification	
anacoenosis	A speaker asks their audience or opponents for their opinion or answer to the point in question.	https://en.wiktionary.org/wiki/anacoenosis	
anacoluthon	An abrupt change of syntax within a sentence. (What I want is — like anybody cares.)	https://en.wiktionary.org/wiki/anacoluthon	
anadiplosis	Repeating the last word of one clause or phrase to begin the next.	https://en.wiktionary.org/wiki/anadiplosis	
analogy	The use of a similar or parallel case or example to reason or argue a point.	https://en.wiktionary.org/wiki/analogy	
anaphora	From [Ancient Greek](https://en.wikipedia.org/wiki/Ancient_Greek) [_ᾰ̓νᾰφορᾱ́_](https://en.wiktionary.org/wiki/%E1%BC%80%CE%BD%CE%B1%CF%86%CE%BF%CF%81%CE%AC#Ancient_Greek) (ănăphorā́). A succession of sentences beginning with the same word or group of words.	https://en.wiktionary.org/wiki/anaphora	
anapodoton	Implying an omitted main clause by a subordinate clause. (If you only knew **...**)	https://en.wiktionary.org/wiki/anapodoton	
anecdote	A brief narrative describing an interesting or amusing event.	https://en.wiktionary.org/wiki/anecdote	
animorum motus	The emotions.	https://en.wiktionary.org/wiki/animorum_motus	
antanaclasis	From [Ancient Greek](https://en.wikipedia.org/wiki/Ancient_Greek) [_ἀντανάκλασις_](https://en.wiktionary.org/wiki/%E1%BC%80%CE%BD%CF%84%CE%B1%CE%BD%CE%AC%CE%BA%CE%BB%CE%B1%CF%83%CE%B9%CF%82#Ancient_Greek) (antanáklasis). A figure of speech involving a pun, consisting of the repeated use of the same word, each time with different meanings.	https://en.wiktionary.org/wiki/antanaclasis	
antiptosis	The substitution of one case for another.	https://en.wiktionary.org/wiki/antiptosis	
antistrophe	In rhetoric, repeating the last word in successive phrases. For example (from [_Rhetorica ad Herennium_](https://en.wikipedia.org/wiki/Rhetorica_ad_Herennium)), "'Since the time when from our state concord disappeared, liberty disappeared, good faith disappeared, friendship disappeared, the common weal disappeared.'" See also [epiphora](https://en.wiktionary.org/wiki/epiphora).	https://en.wiktionary.org/wiki/antistrophe	
antithesis	The juxtaposition of contrasting ideas in balanced or parallel words, phrases, or grammatical structures; the second stage of the dialectic process.	https://en.wiktionary.org/wiki/antithesis	
aphaeresis	The omission of a syllable from the beginning of a word.	https://en.wiktionary.org/wiki/aphaeresis	
apocope	The omission of the last letter or syllable of a word.	https://en.wiktionary.org/wiki/apocope	
apophasis/ apophesis	Pretending to deny something as a means of implicitly affirming it. Mentioning something by saying that you won't mention it.	https://en.wiktionary.org/wiki/apophasis	
aporia	An attempt to discredit an opposing viewpoint by casting doubt on it.	https://en.wiktionary.org/wiki/aporia	
aposiopesis	An abrupt stop in the middle of a sentence; used by a speaker to convey unwillingness or inability to complete a thought or statement.	https://en.wiktionary.org/wiki/aposiopesis	
apostrophe	From [Ancient Greek](https://en.wikipedia.org/wiki/Ancient_Greek) [_ἀποστροφή_](https://en.wiktionary.org/wiki/%E1%BC%80%CF%80%CE%BF%CF%83%CF%84%CF%81%CE%BF%CF%86%CE%AE#Ancient_Greek) (apostrophḗ). A figure of speech consisting of a sudden turn in a text towards an exclamatory address to an imaginary person or a thing.	https://en.wiktionary.org/wiki/apostrophe	
appeals	Rhetorical devices used to enhance the plausibility of one's argument; [Aristotle](https://en.wikipedia.org/wiki/Aristotle)'s appeals included [ethos](https://en.wiktionary.org/wiki/ethos), [logos](https://en.wiktionary.org/wiki/logos), and [pathos](https://en.wiktionary.org/wiki/pathos).	https://en.wiktionary.org/wiki/appeals	
arete	Virtue, excellence of character, qualities that would be inherent in a "natural leader," a component of _ethos_.	https://en.wiktionary.org/wiki/arete	
argument	Discourse characterized by reasons advanced to support conclusions.	https://en.wiktionary.org/wiki/argument	
argumentum ad baculum	Settling a question by appealing to force.	https://en.wiktionary.org/wiki/argumentum_ad_baculum	
argumentum ad hominem	Using what you know about your opponent's character as a basis for your argument.	https://en.wiktionary.org/wiki/argumentum_ad_hominem	
arrangement	See [dispositio](https://en.wiktionary.org/wiki/dispositio).	https://en.wiktionary.org/wiki/arrangement	
ars arengandi	Teaching of forensic speaking during the Medieval rhetorical era.	https://en.wiktionary.org/wiki/ars_arengandi	
ars dictaminis	The art of writing letters, introduced and taught during the Medieval rhetorical era.	https://en.wiktionary.org/wiki/ars_dictaminis	
ars poetria	Medieval teaching of grammar and style through analysis of poetry.	https://en.wiktionary.org/wiki/ars_poetria	
ars praedicandi	The art of preaching based on rhetorical ideas and introduced during the Medieval rhetorical era during an increasing intersection between rhetoric and religion.	https://en.wiktionary.org/wiki/ars_praedicandi	
artistic proofs	Rhetorically-produced methods for persuasion. For [Aristotle](https://en.wikipedia.org/wiki/Aristotle), three possibilities would be [ethos](https://en.wiktionary.org/wiki/ethos), [pathos](https://en.wiktionary.org/wiki/pathos), and [logos](https://en.wiktionary.org/wiki/logos).	https://en.wiktionary.org/wiki/artistic_proofs	
asyndeton	The deliberate omission of [conjunctions](https://en.wiktionary.org/wiki/conjunction) that would normally be used.	https://en.wiktionary.org/wiki/asyndeton	
audience	Real, imagined, invoked, or ignored, this is a concept that seems to be at the very center of the intersections of composing and rhetoric.	https://en.wiktionary.org/wiki/audience	
auxesis	To place words or phrases in a certain order to obtain a climactic effect, or to use a word or phrase which disproportionately amplifies something actually of a lesser nature.	https://en.wiktionary.org/wiki/auxesis	
axioms	The point where scientific reasoning starts. Principles that are not questioned.	https://en.wiktionary.org/wiki/axioms	
backing	Supporting an argument's merit.	https://en.wiktionary.org/wiki/backing	
barbarismus	Mispronunciation or unnatural word-usage.	https://en.wiktionary.org/wiki/barbarismus	
bases	The issues at question in a judicial case.	https://en.wiktionary.org/wiki/bases	
bathos	An emotional appeal that inadvertently evokes laughter or ridicule.	https://en.wiktionary.org/wiki/bathos	
bdelygma	Expression of hatred or contempt.	https://en.wiktionary.org/wiki/bdelygma	
belles lettres	Written works considered quality because they are pleasing to the senses.	https://en.wiktionary.org/wiki/belles_lettres	
belletristicmovement	Movement of rhetoric in the late 18th and early 19th centuries emphasizing stylistic considerations of rhetoric. It also expanded rhetoric into a study of literature and literary criticism and writing.	https://en.wiktionary.org/wiki/belletristic, https://en.wiktionary.org/wiki/movement	
bomphiologia	Bombastic speech.	https://en.wiktionary.org/wiki/bomphiologia	
brachylogia	Brevity of diction.	https://en.wiktionary.org/wiki/brachylogia	
brevitas	Concise expression.	https://en.wiktionary.org/wiki/brevitas	
burden of proof	Theory of argument giving the obligation of proving a case to the challenging party.	https://en.wiktionary.org/wiki/burden_of_proof	
canon	A term often used to discuss significant literary works in a specific field, used by [Cicero](https://en.wiktionary.org/wiki/Cicero) to outline five significant parts of the rhetorical composition process.	https://en.wiktionary.org/wiki/canon	
captatio benevoluntatiae	From [Latin](https://en.wikipedia.org/wiki/Latin). The part of a letter which secures the goodwill of the recipient.	https://en.wiktionary.org/wiki/captatio_benevoluntatiae	
catachresis	The inexact use of a similar word in place of the proper one to create an unlikely metaphor. For example (from _Rhetorica ad Herennium_), "'The power of man is short'" or "'the long wisdom in the man.'"	https://en.wiktionary.org/wiki/catachresis	
charisma	An attribute that allows a speaker's words to become powerful.	https://en.wiktionary.org/wiki/charisma	
circa rem	From [Latin](https://en.wikipedia.org/wiki/Latin). The circumstances _surrounding the act_ in one Roman topical system.	https://en.wiktionary.org/wiki/circa_rem	
claim	A primary point being made to support an argument. Or, the resulting conclusion to an argument. ([Stephen Toulmin](https://en.wikipedia.org/wiki/Stephen_Toulmin))	https://en.wiktionary.org/wiki/claim	
classicism	A revival in the interest of classical antiquity languages and texts.	https://en.wiktionary.org/wiki/classicism	
climax	Climax occurs when words or sentences are used to increase weight by mounting degrees in parallel construction.	https://en.wiktionary.org/wiki/climax	
colon	From [Ancient Greek](https://en.wikipedia.org/wiki/Ancient_Greek) [_κῶλον_](https://en.wiktionary.org/wiki/%CE%BA%E1%BF%B6%CE%BB%CE%BF%CE%BD#Ancient_Greek) (kôlon). A rhetorical figure consisting of a clause which is grammatically, but not logically, complete.	https://en.wiktionary.org/wiki/colon	
common topics	Arguments and approaches useful in rhetorical settings; _koinoi topoi._	https://en.wiktionary.org/wiki/common_topics	
consubstantiality	Substance commonality.	https://en.wiktionary.org/wiki/consubstantiality	
conclusio	From [Latin](https://en.wikipedia.org/wiki/Latin). A letter's conclusion.	https://en.wiktionary.org/wiki/conclusio	
confirmatio	From [Latin](https://en.wikipedia.org/wiki/Latin). The section of a judicial speech (in Roman rhetorical theory) that offers evidence supporting the claims given during the statement of facts.	https://en.wiktionary.org/wiki/confirmatio	
confutatio	From [Latin](https://en.wikipedia.org/wiki/Latin). Counterargument in Roman rhetorical theory.	https://en.wiktionary.org/wiki/confutatio	
constraints	Referring to "persons, events, objects, and relations which are parts of the situation because they have the power to constrain decision and action needed to modify the exigence." Originally used by [Lloyd Bitzer](https://en.wikipedia.org/wiki/Lloyd_Bitzer).	https://en.wiktionary.org/wiki/constraints	
contingency	In rhetoric, it relates to the contextual circumstances that do not allow an issue to be settled with complete certainty.	https://en.wiktionary.org/wiki/contingency	
context	The circumstances surrounding an issue that should be considered during its discussion.	https://en.wiktionary.org/wiki/context	
conversio	From [Latin](https://en.wikipedia.org/wiki/Latin). Varying sentence structure to discover its most agreeable form.	https://en.wiktionary.org/wiki/conversio	
conversation model	The model, in critique of traditional rhetoric by [Sally Gearhart](https://en.wikipedia.org/wiki/Sally_Gearhart), that maintains the goal of rhetoric is to persuade others to accept your own personal view as correct.	https://en.wiktionary.org/wiki/conversation_model	
cookery	[Plato](https://en.wikipedia.org/wiki/Plato) believed rhetoric was to truth as cookery was to medicine. Cookery disguises itself as medicine and appears to be more pleasing, when in actuality it has no real benefit.	https://en.wiktionary.org/wiki/cookery	
critical theory	Systematically analyzing any means of communication for hidden assumptions and connotations.	https://en.wiktionary.org/wiki/critical_theory	
concession	Acknowlededment of objections to a proposal.	https://en.wiktionary.org/wiki/concession	
data	Initial evidence supporting a claim. ([Stephen Toulmin](https://en.wikipedia.org/wiki/Stephen_Toulmin))	https://en.wiktionary.org/wiki/data	
deconstruction	Analyzing communication artifacts by scrutinizing their meanings and related assumptions, with the goal of determining the social and systemic connotations behind their structure.	https://en.wiktionary.org/wiki/deconstruction	
deduction	Moving from an overall hypothesis to infer something specific about that hypothesis.	https://en.wiktionary.org/wiki/deduction	
delectare	To delight; viewed by [Cicero](https://en.wikipedia.org/wiki/Cicero) as one of the three goals of rhetoric.	https://en.wiktionary.org/wiki/delectare	
delivery	Fifth canon in [Cicero](https://en.wikipedia.org/wiki/Cicero)'s list of rhetorical canons; traditionally linked to oral rhetoric, refers to how a speech is given (including tone of voice and nonverbal gestures, among others).	https://en.wiktionary.org/wiki/delivery	
demos	The population of an ancient Greek state, considered a political entity; population; the common people.	https://en.wiktionary.org/wiki/demos	
dialectic	A rhetorical term that has been defined differently by Aristotle and Ramus, among others; generally, it means using verbal communication between people to discuss topics in order to come to an agreement about them.	https://en.wiktionary.org/wiki/dialectic	
diallage	Establishing a single point with the use of several arguments.	https://en.wiktionary.org/wiki/diallage	
dictamen	The art of writing letters.	https://en.wiktionary.org/wiki/dictamen	
dispositio	In the classical theory of the production of speech ([pronuntiatio](https://en.wiktionary.org/wiki/pronuntiatio)), dispositio refers to the stage of planning the structure and sequence of ideas. Often referred to as arrangement, the second of [Cicero](https://en.wikipedia.org/wiki/Cicero)'s five rhetorical canons.	https://en.wiktionary.org/wiki/dispositio	
dissoi logoi	Contradictory arguments.	https://en.wiktionary.org/wiki/dissoi_logoi	
distribution	Dividing a whole subject into its various parts.	https://en.wiktionary.org/wiki/distribution	
divisio	To divide into categories or classes.	https://en.wiktionary.org/wiki/divisio	
docere	To teach; viewed by [Cicero](https://en.wikipedia.org/wiki/Cicero) as one of the three goals of rhetoric.	https://en.wiktionary.org/wiki/docere	
dramatistic	A way to look at the nature of language stressing on language as an action. For example, it uses expressions such as 'thou shalt' and 'thou shalt not." ([Kenneth Burke](https://en.wikipedia.org/wiki/Kenneth_Burke)).	https://en.wiktionary.org/wiki/dramatistic	
dysphemism	A term with negative associations for something in reality fairly innocuous or inoffensive.	https://en.wiktionary.org/wiki/dysphemism	
ecphonesis	A sentence consisting of a single word or short phrase ending with an [exclamation point](https://en.wiktionary.org/wiki/exclamation_point).	https://en.wiktionary.org/wiki/ecphonesis	
elocutio	In the classical theory of the production of a speech ([pronuntiatio](https://en.wiktionary.org/wiki/pronuntiatio)), elocution refers to the stage of elaborating the wording of a text, using correct grammar and diction.	https://en.wiktionary.org/wiki/elocutio	
enthymeme	A type of argument that is grounded in assumed commonalities between a rhetor and the audience. For example, "(claim 1) Bob is a person. Therefore, (claim 3) Bob is mortal." The assumption (unstated claim 2) is that "People are mortal." A type of [syllogism](https://en.wiktionary.org/wiki/syllogism). Started by [Aristotle](https://en.wikipedia.org/wiki/Aristotle).	https://en.wiktionary.org/wiki/enthymeme	
enumeratio	Making a point more forcibly by listing detailed causes or effects; to enumerate: count off or list one by one.	https://en.wiktionary.org/wiki/enumeratio	
epanaphora	In rhetoric, repeating the same word or phrase at the beginning of successive phrases for emphasis. For example (from [_Rhetorica ad Herennium_](https://en.wikipedia.org/wiki/Rhetorica_ad_Herennium)), "'To you must go the credit for this, to you are thanks due, to you will this act of yours bring glory.'"	https://en.wiktionary.org/wiki/epanaphora	
epideictic	Ceremonial rhetoric, such as might be found in a funeral or victory speech.	https://en.wiktionary.org/wiki/epideictic	
epiphora	The repetition of a phrase or word at the end of several sentences or clauses. Also see anaphora.	https://en.wiktionary.org/wiki/epiphora	
epistemology	Philosophical study directed at understanding how people gain knowledge.	https://en.wiktionary.org/wiki/epistemology	
epistrophe	A succession of clauses, phrases or sentences that all end with the same word or group of words.	https://en.wiktionary.org/wiki/epistrophe	
epithet	A term used as a descriptive and qualifying substitute for the name of a person, place or thing.	https://en.wiktionary.org/wiki/epithet	
epizeuxis	Emphasizing an idea using one word repetition.	https://en.wiktionary.org/wiki/epizeuxis	
ethos	A rhetorical appeal to an audience based on the speaker/writer's credibility.	https://en.wiktionary.org/wiki/ethos	
ethopoeia	The act of putting oneself into the character of another to convey that persons feelings and thoughts more vividly.	https://en.wiktionary.org/wiki/ethopoeia	
euphemism	An innocuous, inoffensive or circumlocutory term or phrase for something unpleasant or obscene.	https://en.wiktionary.org/wiki/euphemism	
evidence	In rhetoric, facts or testimony used to strengthen a claim.	https://en.wiktionary.org/wiki/evidence	
exemplum	The citation of an example, either truthful or fictitious.	https://en.wiktionary.org/wiki/exemplum	
exigence	A rhetorical call to action; a situation that compels someone to speak out.	https://en.wiktionary.org/wiki/exigence	
exordium	From [Latin](https://en.wikipedia.org/wiki/Latin) [_exordium_](https://en.wiktionary.org/wiki/exordium#Latin) (“[beginning](https://en.wiktionary.org/wiki/beginning)”). The introductory portion of an [oration](https://en.wiktionary.org/wiki/oration).	https://en.wiktionary.org/wiki/exordium	
expression	Applying the correct language to an argument.	https://en.wiktionary.org/wiki/expression	
fable	A short allegorical story.	https://en.wiktionary.org/wiki/fable	
facetiae	From [Latin](https://en.wikipedia.org/wiki/Latin). Humor or wit.	https://en.wiktionary.org/wiki/facetiae	
facilitas	The improvising of effective oral or written language to suit any situation.	https://en.wiktionary.org/wiki/facilitas	
faculty psychology	The mind contains faculties that include understanding, imagination, passion, and will. (18th century)	https://en.wiktionary.org/wiki/faculty_psychology	
false consciousness	A distorted view of reality, people, and the world. ([Jurgen Habermas](https://en.wikipedia.org/wiki/Jurgen_Habermas)).	https://en.wiktionary.org/wiki/false_consciousness	
feminist rhetoric	Rhetorical theory concerned with feminism and its critique of social structures.	https://en.wiktionary.org/wiki/feminist_rhetoric	
fictio	The attribution of rational traits to non-rational creatures.	https://en.wiktionary.org/wiki/fictio	
field-dependent	Standards for assessing arguments that are specific to a certain field. ([Stephen Toulmin](https://en.wikipedia.org/wiki/Stephen_Toulmin))	https://en.wiktionary.org/wiki/field-dependent	
field-invariant	Standards for assessing arguments that are not determined by the particular field. ([Stephen Toulmin](https://en.wikipedia.org/wiki/Stephen_Toulmin))	https://en.wiktionary.org/wiki/field-invariant	
figure	Unusual arrangement of language that tries to achieve unique meaning for ideas.	https://en.wiktionary.org/wiki/figure	
forensic oratory	speaking in a courtroom.	https://en.wiktionary.org/wiki/forensic_oratory	
forum	A way to complicate our notions of audience and to help writers consider important factors that affect planning and composing.	https://en.wiktionary.org/wiki/forum	
gens	From [Latin](https://en.wikipedia.org/wiki/Latin). An influential group of families.	https://en.wiktionary.org/wiki/gens	
genera	Plural of [genus](https://en.wiktionary.org/wiki/genus). Classification by race, kind, or possession of similarities; discriptive of different types of oratory.	https://en.wiktionary.org/wiki/genera	
graecismus	The use of Greek idiom.	https://en.wiktionary.org/wiki/graecismus	
hermeneutics	The theoretical underpinnings of interpreting texts, usually religious or literary.	https://en.wiktionary.org/wiki/hermeneutics	
heteroglossia	The many prolific languages of any culture.	https://en.wiktionary.org/wiki/heteroglossia	
heuristics	Determining or applying the proper methods for investigation.	https://en.wiktionary.org/wiki/heuristics	
homiologia	A tedious style or redundancy of style.	https://en.wiktionary.org/wiki/homiologia	
homoioteleuton	From [Ancient Greek](https://en.wikipedia.org/wiki/Ancient_Greek) [_ὁμοιοτέλευτον_](https://en.wiktionary.org/wiki/%E1%BD%81%CE%BC%CE%BF%CE%B9%CE%BF%CF%84%CE%AD%CE%BB%CE%B5%CF%85%CF%84%CE%BF%CF%82#Ancient_Greek) (homoiotéleuton). A figure of speech where adjacent or parallel words have similar endings.	https://en.wiktionary.org/wiki/homoioteleuton	
horismus	A brief and often antithetical definition.	https://en.wiktionary.org/wiki/horismus	
hyperbole	A figure of speech where emphasis is achieved through exaggeration, independently or through comparison. For example (from _Rhetorica ad Herennium_), "'His body was as white as snow, his face burned like fire.'"	https://en.wiktionary.org/wiki/hyperbole	
hypophora	When a speaker asks aloud what their adversaries have to say for themselves or against the speaker, and then proceeds to answer the question. For example (from [_Rhetorica ad Herennium_](https://en.wikipedia.org/wiki/Rhetorica_ad_Herennium)), "'When he reminded you of your old friendship, were you moved? No, you killed him nevertheless, and with even greater eagerness. And then when his children grovelled at your feet, were you moved to pity? No, in your extreme cruelty you even prevented their father's burial.'"	https://en.wiktionary.org/wiki/hypophora	
hypothesis	An educated guess.	https://en.wiktionary.org/wiki/hypothesis	
hypsos	Great or worthy writing, sometimes called sublime. Longinus's theme in [_On the Sublime_](https://en.wikipedia.org/wiki/On_the_Sublime).	https://en.wiktionary.org/wiki/hypsos	
hypozeuxis	A sentence in which every clause has its own subject and verb.	https://en.wiktionary.org/wiki/hypozeuxis	
icon	Using imagery to create resemblance.	https://en.wiktionary.org/wiki/icon	
identification	Connecting with a larger group through a shared interpretation or understanding of a larger concept; [Kenneth Burke](https://en.wikipedia.org/wiki/Kenneth_Burke) was one of the first people to use the term in this way.	https://en.wiktionary.org/wiki/identification	
ideology	A way of understanding one's external surroundings.	https://en.wiktionary.org/wiki/ideology	
ignoratio elenchi	A conclusion that is irrelevant.	https://en.wiktionary.org/wiki/ignoratio_elenchi	
imitatio	From [Latin](https://en.wikipedia.org/wiki/Latin). Imitation.	https://en.wiktionary.org/wiki/imitatio	
inartistic proofs	Discovered information stemming from the raw data of experience.	https://en.wiktionary.org/wiki/inartistic_proofs	
indefinite questions	Questions that are discussed without referring to anything specifically. ([Quintilian](https://en.wikipedia.org/wiki/Quintilian))	https://en.wiktionary.org/wiki/indefinite_questions	
indignatio	To arouse indignation in the audience.	https://en.wiktionary.org/wiki/indignatio	
induction	Rhetorical method for coming to general conclusions through specific examples.	https://en.wiktionary.org/wiki/induction	
ingenium	From [Latin](https://en.wiktionary.org/wiki/Latin). The ability to understand similarities and relationships that is innate in all humans. ([Giambattista Vico](https://en.wikipedia.org/wiki/Giambattista_Vico))	https://en.wiktionary.org/wiki/ingenium	
in re	From [Latin](https://en.wiktionary.org/wiki/Latin). Arguments concerned with what actually happened.	https://en.wiktionary.org/wiki/in_re	
institutio oratoria	Educational and rhetorical principles as described and prescribed in treatise by [Quintilian](https://en.wikipedia.org/wiki/Quintilian).	https://en.wiktionary.org/wiki/institutio_oratoria	
insultatio	Abusing a person to their face by using irony and derisive language.	https://en.wiktionary.org/wiki/insultatio	
