term	definition	term_links	wikidata_qid
interlacement	Combining the figures [antistrophe](https://en.wiktionary.org/wiki/antistrophe) and [epanaphora](https://en.wiktionary.org/wiki/epanaphora) for rhetorical style and emphasis. For example (from [_Rhetorica ad Herennium_](https://en.wikipedia.org/wiki/Rhetorica_ad_Herennium)), "'Who are they who have often broken treaties? The Carthaginians. Who are they who have waged ware with severest cruelty? The Carthaginians.'"	https://en.wiktionary.org/wiki/interlacement	
intersubjective agreements	agreements on the fair conduct of an argument among individuals participating in dialogue.	https://en.wiktionary.org/wiki/intersubjective_agreements	
invention	Described by [Cicero](https://en.wikipedia.org/wiki/Cicero) as the process of determining "valid or seemingly valid arguments;" the first of his five rhetorical canons.	https://en.wiktionary.org/wiki/invention	
invitational rhetoric	Rhetoric that is not intended to persuade. ([Sonja K. Foss](https://en.wikipedia.org/wiki/Sonja_K._Foss), Cindy L. Griffin)	https://en.wiktionary.org/wiki/invitational_rhetoric	
ioci	Jokes, see [Cicero](https://en.wikipedia.org/wiki/Cicero)'s [_De Oratore_](https://en.wikipedia.org/wiki/De_Oratore) and his theory of humor.	https://en.wiktionary.org/wiki/ioci	
irony	A deliberate contrast between indirect and direct meaning to draw attention to the opposite.	https://en.wiktionary.org/wiki/irony	
isocolon	A string of phrases of corresponding structure and equal length.	https://en.wiktionary.org/wiki/isocolon	
issues of definition	Things related to naming an act.	https://en.wiktionary.org/wiki/issues_of_definition	
issues of fact	Issues related to an act's occurrence.	https://en.wiktionary.org/wiki/issues_of_fact	
issues of quality	Issues related to the seriousness of an act.	https://en.wiktionary.org/wiki/issues_of_quality	
jargon	Highly technical language used by specific group.	https://en.wiktionary.org/wiki/jargon	
jian shi	From [Chinese](https://en.wikipedia.org/wiki/Chinese_language) [_諫士_](https://en.wiktionary.org/wiki/諫士)／[_谏士_](https://en.wiktionary.org/wiki/谏士) (_jiànshì_). Traveling political advisors common in ancient China.	https://en.wiktionary.org/wiki/jian_shi	
judicial	Type of oratory used to attack or defend someone.	https://en.wiktionary.org/wiki/judicial	
kairos	From [Ancient Greek](https://en.wikipedia.org/wiki/Ancient_Greek) [_καιρός_](https://en.wiktionary.org/wiki/%CE%BA%CE%B1%CE%B9%CF%81%CF%8C%CF%82#Ancient_Greek) (kairós). Generally means "timing" or "the right circumstances."	https://en.wiktionary.org/wiki/kairos	
kategoria	From [Ancient Greek](https://en.wikipedia.org/wiki/Ancient_Greek). Accusation.	https://en.wiktionary.org/wiki/kategoria#English	
koinoi topoi	From [Ancient Greek](https://en.wikipedia.org/wiki/Ancient_Greek). Common topics; in a rhetoric situation, useful arguments and strategies.	https://en.wiktionary.org/wiki/koinoi_topoi	
koinonia	From [Ancient Greek](https://en.wikipedia.org/wiki/Ancient_Greek). To consult with your opponent or judge.	https://en.wiktionary.org/wiki/koinonia	
kolakeia	From [Ancient Greek](https://en.wikipedia.org/wiki/Ancient_Greek). Flattery; telling people what they want to hear while disregarding their best interests; employed by sophistic rhetoricians.	https://en.wiktionary.org/wiki/kolakeia	
latinitas	Stylistic feature involving the proper use of language.	https://en.wiktionary.org/wiki/latinitas	
lexis	Style.	https://en.wiktionary.org/wiki/lexis	
literae humanae	Academic disciplines that are known as the liberal arts: languages, philosophy, history, literature, music, art and certain abstact sciences.	https://en.wiktionary.org/wiki/literae_humanae	
litotes	Stating a positive by negating the negative — a form of understatement. ("I am not unaware of your difficulties.")	https://en.wiktionary.org/wiki/litotes	
localism	A word, phrase, or custom particular to one's location.	https://en.wiktionary.org/wiki/localism	
loci communes	Types of arguments. [Quintilian](https://en.wikipedia.org/wiki/Quintilian) trained orators to learn intellectual habits to access the arguments quickly.	https://en.wiktionary.org/wiki/loci_communes	
locution	Refers to the utterance of a statement.	https://en.wiktionary.org/wiki/locution	
logical fallacy	Misconceptions resulting from faulty reasoning.	https://en.wiktionary.org/wiki/logical_fallacy	
logical positivism	The effort to make scientific standards applicable for resolving all issues.	https://en.wiktionary.org/wiki/logical_positivism	
logical proof	Arguments used to persuade audience. Reasoned.	https://en.wiktionary.org/wiki/logical_proof	
logos	Rhetorical appeals based on logic or reasoning.	https://en.wiktionary.org/wiki/logos	
logology	Kenneth Burke. Study of the specific theological terms used. Not to find the truth or falseness of the statement, but why that particular word was chosen.	https://en.wiktionary.org/wiki/logology	
major premise	Statement in a syllogism. Generalization.	https://en.wiktionary.org/wiki/major_premise	
magnanimity	Doing good to others, "its opposite is meanness of spirit" (from [Aristotle](https://en.wikipedia.org/wiki/Aristotle)'s [_Rhetoric_](https://en.wikipedia.org/wiki/Rhetoric_(Aristotle))).	https://en.wiktionary.org/wiki/magnanimity	
material fallacy	False notion concerning the subject matter of an argument.	https://en.wiktionary.org/wiki/material_fallacy	
maxim	"A saying drawn from life, which shows concisely either what happens or ought to happen in life, for example: 'Every beginning is difficult.'" (from [_Rhetorica ad Herennium_](https://en.wikipedia.org/wiki/Rhetorica_ad_Herennium))	https://en.wiktionary.org/wiki/maxim	
meiosis	A figure of speech in which a word or phrase diminutively substitutes as a reference for something actually of a greater nature.	https://en.wiktionary.org/wiki/meiosis	
memory	Described by [Cicero](https://en.wikipedia.org/wiki/Cicero) as the "firm mental grasp of matter and words;" the fourth of his five rhetorical canons.	https://en.wiktionary.org/wiki/memory	
meta-narratives	Universal theories positing to know all aspects of humanity.	https://en.wiktionary.org/wiki/meta-narratives	
metaphor	A figure of speech where a word that normally applies to one thing is used to designate another for the sake of creating a mental picture. For example (from [_Rhetorica ad Herennium_](https://en.wikipedia.org/wiki/Rhetorica_ad_Herennium)), "'...he lightly breathed a favoring breath'".	https://en.wiktionary.org/wiki/metaphor	
metonym	A figure of speech which substitutes one part for the whole. For example, to count how many cattle in a herd, one counts the heads. To describe the herd, one would say, "There are fifty head of cattle." This does not mean there are only heads, but the head is substituting for the whole animal.	https://en.wiktionary.org/wiki/metonym	
metonymy	A figure of speech which substitutes one word or phrase for another with which it is closely associated. For example (from [_Rhetorica ad Herennium_](https://en.wikipedia.org/wiki/Rhetorica_ad_Herennium)), "one should say 'wine' for 'Liber', 'wheat' for 'Ceres'."	https://en.wiktionary.org/wiki/metonymy	
metron	From [Ancient Greek](https://en.wikipedia.org/wiki/Ancient_Greek). Measure.	https://en.wiktionary.org/wiki/metron	
minor premise	Statement in an argument.	https://en.wiktionary.org/wiki/minor_premise	
modus inveniendi	From [Latin](https://en.wikipedia.org/wiki/Latin). Material used to understand the scriptures. ([Augustine of Hippo](https://en.wikipedia.org/wiki/Augustine_of_Hippo))	https://en.wiktionary.org/wiki/modus_inveniendi	
modus proferendi	From [Latin](https://en.wikipedia.org/wiki/Latin). expressing ideas found within the scriptures. ([Augustine of Hippo](https://en.wikipedia.org/wiki/Augustine_of_Hippo))	https://en.wiktionary.org/wiki/modus_proferendi	
moral reasoning	Reasoning employed in rhetoric that determines a conclusion based on evidence. Used in issues of ethics, religion, economics, and politics.	https://en.wiktionary.org/wiki/moral_reasoning	
motive	Something that plays a role in one's decision to act.	https://en.wiktionary.org/wiki/motive	
movere	To persuade; viewed by [Cicero](https://en.wikipedia.org/wiki/Cicero) as one of the three goals of rhetoric.	https://en.wiktionary.org/wiki/movere	
narratio	A presentation of essential facts in a judicial speech.	https://en.wiktionary.org/wiki/narratio	
narration	Story telling, involving the elements of time, place, actor, action, cause and manner.	https://en.wiktionary.org/wiki/narration	
necessary cause	Cause without which effect couldn't/wouldn't have occurred.	https://en.wiktionary.org/wiki/necessary_cause	
negatio	To negate or deny.	https://en.wiktionary.org/wiki/negatio	
neoplatonism	School of thought emanating from the works of [Plato](https://en.wikipedia.org/wiki/Plato) and [Aristotle](https://en.wikipedia.org/wiki/Aristotle) in early B.C.E. Rome.	https://en.wiktionary.org/wiki/neoplatonism	
noema	Speech that is deliberately subtle or obscure.	https://en.wiktionary.org/wiki/noema	
nomos	From [Ancient Greek](https://en.wikipedia.org/wiki/Ancient_Greek). a social custom or convention.	https://en.wiktionary.org/wiki/nomos	
non sequitur	A statement bearing no relationship to the preceding context.	https://en.wiktionary.org/wiki/non_sequitur	
notaries	Secretaries trained in rhetoric for dealing with the agreements that were needed for commercial cities in Italy to function.	https://en.wiktionary.org/wiki/notaries	
oictos	To show pity or compassion.	https://en.wiktionary.org/wiki/oictos	
ominatio	A prophecy of evil.	https://en.wiktionary.org/wiki/ominatio	
onomatopoeia	Words that imitate the sounds, objects, or actions they refer to. (ex. "buzz", "hullabaloo," "bling")	https://en.wiktionary.org/wiki/onomatopoeia	
opening	First part of discourse. Should gain audiences' attention.	https://en.wiktionary.org/wiki/opening	
optatio	A wish exclaimed.	https://en.wiktionary.org/wiki/optatio	
orcos	An oath.	https://en.wiktionary.org/wiki/orcos	
oxymoron	A condensed paradox.	https://en.wiktionary.org/wiki/oxymoron	
paradeigma	From [Ancient Greek](https://en.wikipedia.org/wiki/Ancient_Greek). Argument created by a list of examples that leads to a probable generalized idea.	https://en.wiktionary.org/wiki/paradeigma	
paradox	A self-contradictory statement, which can only be true if it is false, and vice versa.	https://en.wiktionary.org/wiki/paradox	
paralipsis	When a rhetor refuses to continue with their current discussion, or passes over the rest of the conversation, or admits that they do not know what else to say. For example, (from [_Rhetorica ad Herennium_](https://en.wikipedia.org/wiki/Rhetorica_ad_Herennium)), "'Your boyhood, indeed, which you dedicated to intemperance of all kinds, I would discuss, if I thought this the right time. But at the present I advisedly leave that aside. This too I pass by, that the tribunes have reported you as irregular in military service.'"	https://en.wiktionary.org/wiki/paralipsis	
parallel syntax	repetition of similar sentence structures.	https://en.wiktionary.org/wiki/parallel_syntax	
paronomasia	A play on words, often for humorous effect.	https://en.wiktionary.org/wiki/paronomasia	
particular audience	The actual audience the orator addresses. ([Chaïm Perelman](https://en.wikipedia.org/wiki/Cha%C3%AFm_Perelman) and [Lucie Olbrechts-Tyteca](https://en.wikipedia.org/wiki/Lucie_Olbrechts-Tyteca))	https://en.wiktionary.org/wiki/particular_audience	
pathos	From [Ancient Greek](https://en.wikipedia.org/wiki/Ancient_Greek). The emotional appeal to an audience in an argument. One of [Aristotle](https://en.wikipedia.org/wiki/Aristotle)'s three proofs.	https://en.wiktionary.org/wiki/pathos	
perfectus orator	From [Latin](https://en.wikipedia.org/wiki/Latin). A complete orator.	https://en.wiktionary.org/wiki/perfectus_orator	
periphrasis	The substitution of many or several words where one would suffice; usually to avoid using that particular word.	https://en.wiktionary.org/wiki/periphrasis	
peroratio	From [Latin](https://en.wikipedia.org/wiki/Latin). The last section of a judicial speech were the speaker is the strongest.	https://en.wiktionary.org/wiki/peroratio	
personification	A figure of speech that gives human characteristics or inanimate objects, or represents an absent person as being present. For example (from [_Rhetorica ad Herennium_](https://en.wikipedia.org/wiki/Rhetorica_ad_Herennium)), "'But if this invincible city should now give utterance to her voice, would she not speak as follows?'"	https://en.wiktionary.org/wiki/personification	
petitio	From [Latin](https://en.wikipedia.org/wiki/Latin). In a letter, an announcement, demand, or request.	https://en.wiktionary.org/wiki/petitio	
phallogocentrism	Examines the relationship between logos (reason) and the phallus (representative of male genitalia). Just as the phallus is implicitly and sometime explicitly assumed to be the only significant sexual organ, the masculine is the accepted as the central point of reference of validity and authority for a society.	https://en.wiktionary.org/wiki/phallogocentrism	
phronesis	From [Ancient Greek](https://en.wikipedia.org/wiki/Ancient_Greek). practical wisdom; common sense.	https://en.wiktionary.org/wiki/phronesis	
physis	From [Ancient Greek](https://en.wikipedia.org/wiki/Ancient_Greek). the strong will rule over the weak.	https://en.wiktionary.org/wiki/physis	
pian	(Ancient China) the art of disputing.	https://en.wiktionary.org/wiki/pian	
pistis	From [Ancient Greek](https://en.wikipedia.org/wiki/Ancient_Greek). belief.	https://en.wiktionary.org/wiki/pistis	
plausibility	Rhetoric that is believable right away due to its association with something that the audience already knows or has experienced.	https://en.wiktionary.org/wiki/plausibility	
pleonasm	The use of more words than necessary to express an idea.	https://en.wiktionary.org/wiki/pleonasm	
poetriae, ars	From [Latin](https://en.wikipedia.org/wiki/Latin). Poetry as an art.	https://en.wiktionary.org/wiki/poetriae,_ars	
polis	From [Ancient Greek](https://en.wikipedia.org/wiki/Ancient_Greek). The city-state, especially the people in the city-state.	https://en.wiktionary.org/wiki/polis	
polyphonic	Having multiple voices.	https://en.wiktionary.org/wiki/polyphonic	
polyptoton	The repetition of a word or root in different cases or [inflections](https://en.wiktionary.org/wiki/inflection) within the same sentence.	https://en.wiktionary.org/wiki/polyptoton	
polysyndeton	The repeated use of conjunctions within a sentence, particularly where they do not necessarily have to be used.	https://en.wiktionary.org/wiki/polysyndeton	
portrayl	Describing a person clearly enough for recognition. For example (from [_Rhetorica ad Herennium_](https://en.wikipedia.org/wiki/Rhetorica_ad_Herennium)), "'I mean him, men of the jury, the ruddy, short, bent man, with white and rather curly hair, blue-grey eyes, and a huge scar on his chin, if perhaps you can recall him to memory.'"	https://en.wiktionary.org/wiki/portrayl	
position	The stance taken by a rhetor that they are attempting to prove through argumentation.	https://en.wiktionary.org/wiki/position	
positivism	Term created by [Auguste Comte](https://en.wikipedia.org/wiki/Auguste_Comte) that posits that science, math, or logic can prove any reasonable claim.	https://en.wiktionary.org/wiki/positivism	
postmodernism	Related to rhetoric, a field of inquiry concerned with the ideological underpinnings of commonly held assumptions.	https://en.wiktionary.org/wiki/postmodernism	
praedicandi, ars	From [Latin](https://en.wikipedia.org/wiki/Latin). Preaching.	https://en.wiktionary.org/wiki/praedicandi,_ars	
pragmatism	Field of thought positing that knowledge was fluid and that traditionally "fixed" entities (like time) were largely contextual; believed that a free society with free individuals was a viable standard for living.	https://en.wiktionary.org/wiki/pragmatism	
presence	Choosing to emphasize certain facts and ideas instead of others, leading the audience along that path. ([Chaïm Perelman](https://en.wikipedia.org/wiki/Cha%C3%AFm_Perelman) and [Lucie Olbrechts-Tyteca](https://en.wikipedia.org/wiki/Lucie_Olbrechts-Tyteca))	https://en.wiktionary.org/wiki/presence	
presumption	An idea is reasonable or acceptable only until it is sufficiently challenged.	https://en.wiktionary.org/wiki/presumption	
pronuntiato	From [Latin](https://en.wikipedia.org/wiki/Latin). The deliverary of an oration or an argument in a manner befitting the subject matter and style, while maintaining control of voice and body.	https://en.wiktionary.org/wiki/pronuntiato	
protreptic	From [Ancient Greek](https://en.wikipedia.org/wiki/Ancient_Greek). The potential to persuade through language.	https://en.wiktionary.org/wiki/protreptic	
prudence	Judging practically.	https://en.wiktionary.org/wiki/prudence	
psogos	From [Ancient Greek](https://en.wikipedia.org/wiki/Ancient_Greek). Blame.	https://en.wiktionary.org/wiki/psogos	
psychagogos	From [Ancient Greek](https://en.wikipedia.org/wiki/Ancient_Greek). A poet.	https://en.wiktionary.org/wiki/psychagogos	
psyche	From [Ancient Greek](https://en.wikipedia.org/wiki/Ancient_Greek). The mind or soul.	https://en.wiktionary.org/wiki/psyche	
public sphere	Place where individuals can engage in discussion without the political or state interests interfering.	https://en.wiktionary.org/wiki/public_sphere	
purpose	What one is trying to do with their use of language.	https://en.wiktionary.org/wiki/purpose	
quadrivium	The major subjects taught in medieval times: geometry, arithmetic, atronomy, and music.	https://en.wiktionary.org/wiki/quadrivium	
quaestiones	Debatable points around which disputes are centered.	https://en.wiktionary.org/wiki/quaestiones	
reasoning by contraries	Where the first statement of two opposite statements directly proves the second. For example (from [_Rhetorica ad Herennium_](https://en.wikipedia.org/wiki/Rhetorica_ad_Herennium)), "'Or how should you expect a person whose arrogance has been insufferable in private life, to be agreeable and not forget himself when in power...?'"	https://en.wiktionary.org/wiki/reasoning_by_contraries	
rebuttal	Conditions on the acceptability of a claim. ([Stephen Toulmin](https://en.wikipedia.org/wiki/Stephen_Toulmin))	https://en.wiktionary.org/wiki/rebuttal	
res	From [Latin](https://en.wikipedia.org/wiki/Latin). An argument's subtance.	https://en.wiktionary.org/wiki/res	
rhetor	A person who is in the course of presenting or preparing rhetorical discourse.	https://en.wiktionary.org/wiki/rhetor	
rhetores	From [Ancient Greek](https://en.wikipedia.org/wiki/Ancient_Greek). Those who make a living by speaking persuasively.	https://en.wiktionary.org/wiki/rhetores	
rhetoric	The study and practice of good effective expression. Also, a type of discourse focusing on goals of the speech or piece of writing that attempts to sway the mind of the audience.	https://en.wiktionary.org/wiki/rhetoric	
rhetorical audience	Those who can be persuaded by rhetoric.	https://en.wiktionary.org/wiki/rhetorical_audience	
rhetorical discourse	Discourse created within the boundary of the principles of rhetoric.	https://en.wiktionary.org/wiki/rhetorical_discourse	
rhetorical opposition	[Protagoras](https://en.wikipedia.org/wiki/Protagoras)'s idea that there are two sides to everything.	https://en.wiktionary.org/wiki/rhetorical_opposition	
rhetorical situation	A term made popular by [Lloyd Bitzer](https://en.wikipedia.org/wiki/Lloyd_Bitzer); describes the scenario that contains a speech act, including the considerations (purpose, audience, author/speaker, constraints to name a few) that play a role in how the act is produced and perceived by its audience. The counterargument regarding Bitzer's situation-rhetoric relationship was made by [Richard E. Vatz](https://en.wikipedia.org/wiki/Richard_E._Vatz) in "The Myth of the Rhetorical Situation." He argued for a salience-meaning (or now, agenda-framing-spin) model of persuasion, which emphasized rhetoric as a creative act with increased agent or persuader responsibility for the situation their rhetoric creates. He maintained this added to the importance of rhetorical study.	https://en.wiktionary.org/wiki/rhetorical_situation	
rhetorical theory	The organized presentation of the art or rhetoric, descriptions of the various functions of rhetoric, and clarifications of how rhetoric achieves its goals.	https://en.wiktionary.org/wiki/rhetorical_theory	
rhetoric of fiction	[Wayne Booth](https://en.wikipedia.org/wiki/Wayne_Booth)'s idea that "the author's judgement is always present" in a narrative.	https://en.wiktionary.org/wiki/rhetoric_of_fiction	
salon	Intellectual assembly in an aristocratic setting; primarily associated with France in the 1600s and 1700s.	https://en.wiktionary.org/wiki/salon	
salutatio	From [Latin](https://en.wikipedia.org/wiki/Latin). A written greeting.	https://en.wiktionary.org/wiki/salutatio	
sannio	From [Latin](https://en.wikipedia.org/wiki/Latin). The fool. The role to avoid when using humor in a speech.	https://en.wiktionary.org/wiki/sannio	
scholasticism	Rhetorical study of Christianity that was intellectually prominent in 11th-15th Century Western Europe, emphasizing rhetorical concepts by [Aristotle](https://en.wikipedia.org/wiki/Aristotle) and a search for universal truth.	https://en.wiktionary.org/wiki/scholasticism	
scientific method	A system of observing and analyzing data through induction; prominent school of thought since the 1600s whose proponents are often critical of rhetoric.	https://en.wiktionary.org/wiki/scientific_method	
scientific reasoning	Moving from axioms to actual conclusions. Also, syllogistic logic.	https://en.wiktionary.org/wiki/scientific_reasoning	
scientism	Applying scientific assumptions to subjects that are not completely natural. ([Richard M. Weaver](https://en.wikipedia.org/wiki/Richard_M._Weaver))	https://en.wiktionary.org/wiki/scientism	
scientistic	Way of looking at the nature of language as a way of naming or defining something. ex. "It is" or "It is not." ([Kenneth Burke](https://en.wikipedia.org/wiki/Kenneth_Burke))	https://en.wiktionary.org/wiki/scientistic	
second sophistic	Rhetorical era in Rome that dealt primarily with rhetorical style through some of the Greek Sophists' concepts, while neglecting its political and social uses because of censorship.	https://en.wiktionary.org/wiki/second_sophistic	
semantics	Philosophical study of language that deals with its connection to perceptions of reality.	https://en.wiktionary.org/wiki/semantics	
semiotics	Branch of semantics concerning language and communication as a system of symbols.	https://en.wiktionary.org/wiki/semiotics	
senatus	[Latin](https://en.wikipedia.org/wiki/Latin) for "senate". The group of elders who governed Rome.	https://en.wiktionary.org/wiki/senatus	
sensus communis	a society's basic beliefs and values.	https://en.wiktionary.org/wiki/sensus_communis	
sententia	Applying a general truth to a situation by quoting a maxim or other wise saying as a conclusion or summary of that situation.	https://en.wiktionary.org/wiki/sententia	
shui	Formal persuasion in ancient China.	https://en.wiktionary.org/wiki/shui	
sign	Term from [semiotics](https://en.wiktionary.org/wiki/semiotics) that describes something that has meaning through its connection to something else, like words.	https://en.wiktionary.org/wiki/sign	
signifying	Term from [semiotics](https://en.wiktionary.org/wiki/semiotics) that describes the method through which meaning is created with arbitrary signs.	https://en.wiktionary.org/wiki/signifying	
simile	A figure of speech that compares unlike things, implying a resemblance between them. For example (from [_Rhetorica ad Herennium_](https://en.wikipedia.org/wiki/Rhetorica_ad_Herennium)), "'He entered the combat in body like the strongest bull, in impetuosity like the fiercest lion.'"	https://en.wiktionary.org/wiki/simile	
skepticism	Type of thought that questions whether universal truth exists and is attainable by humans.	https://en.wiktionary.org/wiki/skepticism	
solecismus	Ignorantly misusing tenses, cases, and genders.	https://en.wiktionary.org/wiki/solecismus	
sophists	Considered the first professional teachers of oratory and rhetoric, in 4th century BC Ancient Greece.	https://en.wiktionary.org/wiki/sophists	
soraismus	The ignorant or affected mingling of languages.	https://en.wiktionary.org/wiki/soraismus	
Sprezzatura	The ability to appear that there is seemingly little effort used to attain success. The art of being able to show that one is able to deceive. ([Baldessare Castiglione](https://en.wikipedia.org/wiki/Baldessare_Castiglione))	https://en.wiktionary.org/wiki/Sprezzatura	
starting points	The place between the speaker and audience where the argument can begin. ([Chaïm Perelman](https://en.wikipedia.org/wiki/Cha%C3%AFm_Perelman) and [Lucie Olbrechts-Tyteca](https://en.wikipedia.org/wiki/Lucie_Olbrechts-Tyteca))	https://en.wiktionary.org/wiki/starting_points	
stasis system	System of finding arguments by means of looking at ideas that are contradictory.	https://en.wiktionary.org/wiki/stasis_system	
status quo	From [Latin](https://en.wikipedia.org/wiki/Latin). The generally accepted existing condition or state of affairs.	https://en.wiktionary.org/wiki/status_quo	
studia humanitas	From [Latin](https://en.wikipedia.org/wiki/Latin). Humanistic studies deemed indispensable in Renaissance-era education; rhetoric, poetics, ethics, politics.	https://en.wiktionary.org/wiki/studia_humanitas	
syllepsis	A word modifying others in appropriate, though often incongruous ways. This is a similar concept to [zeugma](https://en.wiktionary.org/wiki/zeugma).	https://en.wiktionary.org/wiki/syllepsis	
